"No.","Time","Source","Destination","Protocol","Length","Info"
"2","0.023138598","104.26.10.104","172.21.0.134","TCP","74","443  >  44548 [SYN, ACK] Seq=0 Ack=1 Win=65160 Len=0 MSS=1380 SACK_PERM TSval=81924579 TSecr=1864124865 WS=8192"
"5","0.054462692","104.26.10.104","172.21.0.134","TCP","66","443  >  44548 [ACK] Seq=1 Ack=668 Win=24576 Len=0 TSval=81924608 TSecr=1864124893"
"6","0.056271974","104.26.10.104","172.21.0.134","TLSv1.3","1434","Server Hello, Change Cipher Spec"
"8","0.057230091","104.26.10.104","172.21.0.134","TCP","1434","443  >  44548 [ACK] Seq=1369 Ack=668 Win=24576 Len=1368 TSval=81924613 TSecr=1864124893 [TCP segment of a reassembled PDU]"
"10","0.057597271","104.26.10.104","172.21.0.134","TCP","1434","443  >  44548 [ACK] Seq=2737 Ack=668 Win=24576 Len=1368 TSval=81924613 TSecr=1864124893 [TCP segment of a reassembled PDU]"
"12","0.058607820","104.26.10.104","172.21.0.134","TLSv1.3","1216","Application Data"
"17","0.108281904","104.26.10.104","172.21.0.134","TLSv1.3","578","Application Data, Application Data"
"18","0.108882147","104.26.10.104","172.21.0.134","TLSv1.3","97","Application Data"
"20","0.132380980","104.26.10.104","172.21.0.134","TCP","66","443  >  44548 [ACK] Seq=5798 Ack=1350 Win=24576 Len=0 TSval=81924689 TSecr=1864124951"
"21","0.150313844","104.26.10.104","172.21.0.134","TLSv1.3","582","Application Data"
"22","0.150977453","104.26.10.104","172.21.0.134","TLSv1.3","1457","Application Data"
"23","0.150977758","104.26.10.104","172.21.0.134","TLSv1.3","2848","Application Data, Application Data"
"24","0.150977853","104.26.10.104","172.21.0.134","TLSv1.3","11010","Application Data, Application Data, Application Data, Application Data, Application Data, Application Data, Application Data"
"27","0.151185693","104.26.10.104","172.21.0.134","TLSv1.3","1434","Application Data"
"28","0.152498386","104.26.10.104","172.21.0.134","TLSv1.3","1434","Application Data"
"30","0.153144431","104.26.10.104","172.21.0.134","TLSv1.3","7251","Application Data, Application Data, Application Data, Application Data, Application Data, Application Data"
"31","0.153144851","104.26.10.104","172.21.0.134","TLSv1.3","9642","Application Data, Application Data, Application Data, Application Data, Application Data, Application Data, Application Data"
"33","0.154023406","104.26.10.104","172.21.0.134","TLSv1.3","1434","[TCP Previous segment not captured] , Continuation Data"
"35","0.154386028","104.26.10.104","172.21.0.134","TLSv1.3","1434","Continuation Data"
"37","0.184707178","104.26.10.104","172.21.0.134","TLSv1.3","1434","Continuation Data"
"39","0.185397326","104.26.10.104","172.21.0.134","TLSv1.3","5538","Continuation Data"
"40","0.185397649","104.26.10.104","172.21.0.134","TLSv1.3","6906","[TCP Previous segment not captured] , Continuation Data"
"41","0.185457007","104.26.10.104","172.21.0.134","TLSv1.3","1434","[TCP Previous segment not captured] , Continuation Data"
"43","0.185688591","104.26.10.104","172.21.0.134","TLSv1.3","1434","Continuation Data"
"44","0.186194010","104.26.10.104","172.21.0.134","TLSv1.3","1434","Continuation Data"
"46","0.215241245","104.26.10.104","172.21.0.134","TCP","1434","[TCP Retransmission] 443  >  44548 [ACK] Seq=40928 Ack=1350 Win=24576 Len=1368 TSval=81924742 TSecr=1864125019"
"48","0.216780445","104.26.10.104","172.21.0.134","TCP","8274","[TCP Retransmission] 443  >  44548 [PSH, ACK] Seq=42296 Ack=1350 Win=24576 Len=8208 TSval=81924742 TSecr=1864125019"
"50","0.216780841","104.26.10.104","172.21.0.134","TLSv1.3","5538","[TCP Previous segment not captured] , Continuation Data"
"52","0.217071692","104.26.10.104","172.21.0.134","TLSv1.3","1434","Continuation Data"
"54","0.218185850","104.26.10.104","172.21.0.134","TLSv1.3","1434","Continuation Data"
"56","0.238718526","104.26.10.104","172.21.0.134","TCP","1434","[TCP Out-Of-Order] 443  >  44548 [ACK] Seq=74030 Ack=1350 Win=24576 Len=1368 TSval=81924795 TSecr=1864125080"
"58","0.245676695","104.26.10.104","172.21.0.134","TCP","1434","[TCP Retransmission] 443  >  44548 [ACK] Seq=75398 Ack=1350 Win=24576 Len=1368 TSval=81924795 TSecr=1864125080"
"59","0.246362587","104.26.10.104","172.21.0.134","TCP","10571","[TCP Retransmission] 443  >  44548 [PSH, ACK] Seq=76766 Ack=1350 Win=24576 Len=10505 TSval=81924795 TSecr=1864125080"
"60","0.246426609","104.26.10.104","172.21.0.134","TCP","1434","[TCP Retransmission] 443  >  44548 [ACK] Seq=87271 Ack=1350 Win=24576 Len=1368 TSval=81924795 TSecr=1864125080"
"61","0.246426796","104.26.10.104","172.21.0.134","TCP","611","[TCP Retransmission] 443  >  44548 [ACK] Seq=88639 Ack=1350 Win=24576 Len=545 TSval=81924796 TSecr=1864125082"
"62","0.246571510","104.26.10.104","172.21.0.134","TLSv1.3","1434","[TCP Previous segment not captured] , Continuation Data"
"64","0.247609288","104.26.10.104","172.21.0.134","TLSv1.3","1434","Continuation Data"
"66","0.263417136","104.26.10.104","172.21.0.134","TCP","1434","[TCP Out-Of-Order] 443  >  44548 [ACK] Seq=60080 Ack=1350 Win=24576 Len=1368 TSval=81924819 TSecr=1864125104"
"68","0.277101284","104.26.10.104","172.21.0.134","TCP","1434","[TCP Retransmission] 443  >  44548 [PSH, ACK] Seq=61448 Ack=1350 Win=24576 Len=1368 TSval=81924819 TSecr=1864125104"
"70","0.277723459","104.26.10.104","172.21.0.134","TCP","336","[TCP Retransmission] 443  >  44548 [ACK] Seq=69656 Ack=1350 Win=24576 Len=270 TSval=81924825 TSecr=1864125111"
"72","0.277723788","104.26.10.104","172.21.0.134","TLSv1.3","12378","[TCP Previous segment not captured] , Continuation Data"
"74","0.278040756","104.26.10.104","172.21.0.134","TLSv1.3","1434","Continuation Data"
"76","0.278880514","104.26.10.104","172.21.0.134","TLSv1.3","1434","Continuation Data"
"78","0.285301095","104.26.10.104","172.21.0.134","TCP","1434","[TCP Out-Of-Order] 443  >  44548 [ACK] Seq=104720 Ack=1350 Win=24576 Len=1368 TSval=81924842 TSecr=1864125128"
"80","0.287271514","104.26.10.104","172.21.0.134","TCP","1434","[TCP Out-Of-Order] 443  >  44548 [PSH, ACK] Seq=106088 Ack=1350 Win=24576 Len=1368 TSval=81924842 TSecr=1864125128"
"82","0.309002768","104.26.10.104","172.21.0.134","TCP","1434","[TCP Retransmission] 443  >  44548 [ACK] Seq=107456 Ack=1350 Win=24576 Len=1368 TSval=81924856 TSecr=1864125142"
"83","0.309639737","104.26.10.104","172.21.0.134","TCP","1434","[TCP Retransmission] 443  >  44548 [ACK] Seq=108824 Ack=1350 Win=24576 Len=1368 TSval=81924856 TSecr=1864125142"
"84","0.309640208","104.26.10.104","172.21.0.134","TCP","2802","[TCP Retransmission] 443  >  44548 [PSH, ACK] Seq=110192 Ack=1350 Win=24576 Len=2736 TSval=81924857 TSecr=1864125143"
"85","0.309640299","104.26.10.104","172.21.0.134","TCP","4170","[TCP Retransmission] 443  >  44548 [ACK] Seq=112928 Ack=1350 Win=24576 Len=4104 TSval=81924857 TSecr=1864125143"
"86","0.309640391","104.26.10.104","172.21.0.134","TLSv1.3","5538","[TCP Previous segment not captured] , Continuation Data"
"87","0.309914968","104.26.10.104","172.21.0.134","TLSv1.3","1434","Continuation Data"
"89","0.310255403","104.26.10.104","172.21.0.134","TLSv1.3","1434","Continuation Data"
"91","0.339774278","104.26.10.104","172.21.0.134","TCP","1434","[TCP Retransmission] 443  >  44548 [ACK] Seq=97392 Ack=1350 Win=24576 Len=1368 TSval=81924866 TSecr=1864125150"
"93","0.340371818","104.26.10.104","172.21.0.134","TCP","1434","[TCP Retransmission] 443  >  44548 [PSH, ACK] Seq=98760 Ack=1350 Win=24576 Len=1368 TSval=81924866 TSecr=1864125150"
"95","0.340372233","104.26.10.104","172.21.0.134","TCP","1922","[TCP Retransmission] 443  >  44548 [PSH, ACK] Seq=100128 Ack=1350 Win=24576 Len=1856 TSval=81924867 TSecr=1864125152"
"97","0.340372328","104.26.10.104","172.21.0.134","TCP","8274","[TCP Retransmission] 443  >  44548 [PSH, ACK] Seq=132080 Ack=1350 Win=24576 Len=8208 TSval=81924889 TSecr=1864125175"
"99","0.340584477","104.26.10.104","172.21.0.134","TCP","1434","[TCP Retransmission] 443  >  44548 [ACK] Seq=140288 Ack=1350 Win=24576 Len=1368 TSval=81924889 TSecr=1864125175"
"101","0.341950880","104.26.10.104","172.21.0.134","TCP","1434","[TCP Retransmission] 443  >  44548 [ACK] Seq=141656 Ack=1350 Win=24576 Len=1368 TSval=81924889 TSecr=1864125175"
"103","0.342281986","104.26.10.104","172.21.0.134","TCP","1434","[TCP Retransmission] 443  >  44548 [ACK] Seq=143024 Ack=1350 Win=24576 Len=1368 TSval=81924889 TSecr=1864125175"
"105","0.362742091","104.26.10.104","172.21.0.134","TLSv1.3","1434","Continuation Data"
"107","0.363062050","104.26.10.104","172.21.0.134","TLSv1.3","1434","Continuation Data"
"109","0.371366305","104.26.10.104","172.21.0.134","TLSv1.3","1434","Continuation Data"
"110","0.372022885","104.26.10.104","172.21.0.134","TLSv1.3","1434","Continuation Data"
"111","0.372023213","104.26.10.104","172.21.0.134","TLSv1.3","2802","Continuation Data"
"112","0.372023405","104.26.10.104","172.21.0.134","TLSv1.3","2802","Continuation Data"
"113","0.372023575","104.26.10.104","172.21.0.134","TLSv1.3","4170","Continuation Data"
"114","0.372114254","104.26.10.104","172.21.0.134","TLSv1.3","2802","Continuation Data"
"115","0.372267039","104.26.10.104","172.21.0.134","TLSv1.3","1434","[TCP Previous segment not captured] , Continuation Data"
"117","0.372974693","104.26.10.104","172.21.0.134","TCP","1434","443  >  44548 [ACK] Seq=195008 Ack=1350 Win=24576 Len=1368 TSval=81924920 TSecr=1864125205 [TCP segment of a reassembled PDU]"
"119","0.402699846","104.26.10.104","172.21.0.134","TCP","1434","[TCP Retransmission] 443  >  44548 [ACK] Seq=144392 Ack=1350 Win=24576 Len=1368 TSval=81924942 TSecr=1864125228"
"121","0.403407787","104.26.10.104","172.21.0.134","TCP","4170","[TCP Retransmission] 443  >  44548 [PSH, ACK] Seq=171752 Ack=1350 Win=24576 Len=4104 TSval=81924942 TSecr=1864125228"
"123","0.403408137","104.26.10.104","172.21.0.134","TCP","9642","[TCP Retransmission] 443  >  44548 [ACK] Seq=175856 Ack=1350 Win=24576 Len=9576 TSval=81924952 TSecr=1864125237"
"125","0.404712157","104.26.10.104","172.21.0.134","TCP","1434","[TCP Retransmission] 443  >  44548 [ACK] Seq=185432 Ack=1350 Win=24576 Len=1368 TSval=81924952 TSecr=1864125237"
"127","0.405001929","104.26.10.104","172.21.0.134","TCP","1434","[TCP Retransmission] 443  >  44548 [ACK] Seq=186800 Ack=1350 Win=24576 Len=1368 TSval=81924952 TSecr=1864125237"
"129","0.426688537","104.26.10.104","172.21.0.134","TCP","1434","443  >  44548 [ACK] Seq=196376 Ack=1350 Win=24576 Len=1368 TSval=81924982 TSecr=1864125268 [TCP segment of a reassembled PDU]"
"131","0.434010499","104.26.10.104","172.21.0.134","TCP","1434","443  >  44548 [PSH, ACK] Seq=197744 Ack=1350 Win=24576 Len=1368 TSval=81924982 TSecr=1864125268 [TCP segment of a reassembled PDU]"
"133","0.435548029","104.26.10.104","172.21.0.134","TCP","4170","443  >  44548 [PSH, ACK] Seq=199112 Ack=1350 Win=24576 Len=4104 TSval=81924983 TSecr=1864125268 [TCP segment of a reassembled PDU]"
"134","0.435548255","104.26.10.104","172.21.0.134","TCP","2802","443  >  44548 [PSH, ACK] Seq=203216 Ack=1350 Win=24576 Len=2736 TSval=81924983 TSecr=1864125268 [TCP segment of a reassembled PDU]"
"135","0.435548346","104.26.10.104","172.21.0.134","SSLv2","2802","Encrypted Data, Continuation Data"
"136","0.435548437","104.26.10.104","172.21.0.134","TLSv1.3","2802","Continuation Data"
"137","0.435614316","104.26.10.104","172.21.0.134","TCP","1434","[TCP Previous segment not captured] 443  >  44548 [ACK] Seq=229208 Ack=1350 Win=24576 Len=1368 TSval=81924983 TSecr=1864125268"
"138","0.436025741","104.26.10.104","172.21.0.134","TLSv1.3","1434","Continuation Data"
"139","0.436345575","104.26.10.104","172.21.0.134","TLSv1.3","929","Continuation Data"
"141","0.448913106","104.26.10.104","172.21.0.134","TCP","1434","[TCP Out-Of-Order] 443  >  44548 [ACK] Seq=188168 Ack=1350 Win=24576 Len=1368 TSval=81925006 TSecr=1864125292"
"143","0.464551269","104.26.10.104","172.21.0.134","TCP","1434","[TCP Retransmission] 443  >  44548 [PSH, ACK] Seq=189536 Ack=1350 Win=24576 Len=1368 TSval=81925006 TSecr=1864125292"
"145","0.465089864","104.26.10.104","172.21.0.134","TCP","2802","[TCP Retransmission] 443  >  44548 [PSH, ACK] Seq=190904 Ack=1350 Win=24576 Len=2736 TSval=81925006 TSecr=1864125292"
"147","0.465090263","104.26.10.104","172.21.0.134","TCP","2802","[TCP Retransmission] 443  >  44548 [PSH, ACK] Seq=211424 Ack=1350 Win=24576 Len=2736 TSval=81925008 TSecr=1864125292"
"149","0.465090409","104.26.10.104","172.21.0.134","TCP","2802","[TCP Retransmission] 443  >  44548 [PSH, ACK] Seq=214160 Ack=1350 Win=24576 Len=2736 TSval=81925009 TSecr=1864125292"
"150","0.465090510","104.26.10.104","172.21.0.134","TCP","2802","[TCP Retransmission] 443  >  44548 [PSH, ACK] Seq=216896 Ack=1350 Win=24576 Len=2736 TSval=81925011 TSecr=1864125292"
"151","0.465222364","104.26.10.104","172.21.0.134","TCP","2802","[TCP Retransmission] 443  >  44548 [PSH, ACK] Seq=219632 Ack=1350 Win=24576 Len=2736 TSval=81925012 TSecr=1864125292"
"155","0.465980293","104.26.10.104","172.21.0.134","TCP","1434","[TCP Retransmission] 443  >  44548 [ACK] Seq=222368 Ack=1350 Win=24576 Len=1368 TSval=81925013 TSecr=1864125292"
"157","0.466882355","104.26.10.104","172.21.0.134","TCP","1434","[TCP Retransmission] 443  >  44548 [PSH, ACK] Seq=223736 Ack=1350 Win=24576 Len=1368 TSval=81925013 TSecr=1864125292"
"159","0.807536056","104.26.10.104","172.21.0.134","TCP","1434","[TCP Retransmission] 443  >  44548 [PSH, ACK] Seq=225104 Ack=1350 Win=24576 Len=1368 TSval=81925282 TSecr=1864125332"
"161","0.829875497","104.26.10.104","172.21.0.134","TCP","1434","[TCP Retransmission] 443  >  44548 [ACK] Seq=226472 Ack=1350 Win=24576 Len=1368 TSval=81925387 TSecr=1864125672"
"163","0.831577092","104.26.10.104","172.21.0.134","TCP","1434","[TCP Retransmission] 443  >  44548 [ACK] Seq=227840 Ack=1350 Win=24576 Len=1368 TSval=81925387 TSecr=1864125672"
"167","2.855031146","104.26.10.104","172.21.0.134","TCP","66","443  >  44548 [ACK] Seq=232807 Ack=1606 Win=24576 Len=0 TSval=81927408 TSecr=1864127692"
"170","2.933670856","104.26.10.104","172.21.0.134","TCP","66","443  >  44548 [ACK] Seq=232807 Ack=1863 Win=24576 Len=0 TSval=81927489 TSecr=1864127774"
"172","3.036556765","104.26.10.104","172.21.0.134","TLSv1.3","397","Application Data"
"173","3.036707573","104.26.10.104","172.21.0.134","TCP","1434","443  >  44548 [ACK] Seq=233138 Ack=2084 Win=24576 Len=1368 TSval=81927593 TSecr=1864127842 [TCP segment of a reassembled PDU]"
"175","3.037124516","104.26.10.104","172.21.0.134","TCP","1434","443  >  44548 [PSH, ACK] Seq=234506 Ack=2084 Win=24576 Len=1368 TSval=81927593 TSecr=1864127842 [TCP segment of a reassembled PDU]"
"176","3.037592432","104.26.10.104","172.21.0.134","TCP","1434","443  >  44548 [ACK] Seq=235874 Ack=2084 Win=24576 Len=1368 TSval=81927595 TSecr=1864127842 [TCP segment of a reassembled PDU]"
"178","3.038724666","104.26.10.104","172.21.0.134","TCP","1434","443  >  44548 [PSH, ACK] Seq=237242 Ack=2084 Win=24576 Len=1368 TSval=81927595 TSecr=1864127842 [TCP segment of a reassembled PDU]"
"179","3.039262518","104.26.10.104","172.21.0.134","TCP","1434","443  >  44548 [ACK] Seq=238610 Ack=2084 Win=24576 Len=1368 TSval=81927596 TSecr=1864127842 [TCP segment of a reassembled PDU]"
"181","3.040508013","104.26.10.104","172.21.0.134","TCP","1434","443  >  44548 [PSH, ACK] Seq=239978 Ack=2084 Win=24576 Len=1368 TSval=81927596 TSecr=1864127842 [TCP segment of a reassembled PDU]"
"182","3.040826581","104.26.10.104","172.21.0.134","TCP","1434","443  >  44548 [ACK] Seq=241346 Ack=2084 Win=24576 Len=1368 TSval=81927598 TSecr=1864127842 [TCP segment of a reassembled PDU]"
"184","3.042557106","104.26.10.104","172.21.0.134","TCP","1434","443  >  44548 [PSH, ACK] Seq=242714 Ack=2084 Win=24576 Len=1368 TSval=81927598 TSecr=1864127842 [TCP segment of a reassembled PDU]"
"185","3.043367988","104.26.10.104","172.21.0.134","TCP","1434","443  >  44548 [ACK] Seq=244082 Ack=2084 Win=24576 Len=1368 TSval=81927600 TSecr=1864127842 [TCP segment of a reassembled PDU]"
"187","3.044813834","104.26.10.104","172.21.0.134","TCP","1434","443  >  44548 [PSH, ACK] Seq=245450 Ack=2084 Win=24576 Len=1368 TSval=81927600 TSecr=1864127842 [TCP segment of a reassembled PDU]"
"188","3.045793338","104.26.10.104","172.21.0.134","TCP","1434","443  >  44548 [ACK] Seq=246818 Ack=2084 Win=24576 Len=1368 TSval=81927601 TSecr=1864127842 [TCP segment of a reassembled PDU]"
"190","3.046916891","104.26.10.104","172.21.0.134","TLSv1.3","1434","Application Data"
"191","3.047945001","104.26.10.104","172.21.0.134","TCP","1434","443  >  44548 [ACK] Seq=249554 Ack=2084 Win=24576 Len=1368 TSval=81927603 TSecr=1864127842 [TCP segment of a reassembled PDU]"
"193","3.049222792","104.26.10.104","172.21.0.134","TCP","1434","443  >  44548 [PSH, ACK] Seq=250922 Ack=2084 Win=24576 Len=1368 TSval=81927603 TSecr=1864127842 [TCP segment of a reassembled PDU]"
"194","3.060217830","104.26.10.104","172.21.0.134","TCP","1434","443  >  44548 [ACK] Seq=252290 Ack=2084 Win=24576 Len=1368 TSval=81927605 TSecr=1864127842 [TCP segment of a reassembled PDU]"
"196","3.062380800","104.26.10.104","172.21.0.134","TCP","1434","443  >  44548 [PSH, ACK] Seq=253658 Ack=2084 Win=24576 Len=1368 TSval=81927605 TSecr=1864127842 [TCP segment of a reassembled PDU]"
"197","3.062381388","104.26.10.104","172.21.0.134","TCP","2802","443  >  44548 [PSH, ACK] Seq=255026 Ack=2084 Win=24576 Len=2736 TSval=81927607 TSecr=1864127842 [TCP segment of a reassembled PDU]"
"199","3.062381543","104.26.10.104","172.21.0.134","TCP","2802","443  >  44548 [PSH, ACK] Seq=257762 Ack=2084 Win=24576 Len=2736 TSval=81927608 TSecr=1864127842 [TCP segment of a reassembled PDU]"
"201","3.062381715","104.26.10.104","172.21.0.134","TCP","2802","443  >  44548 [PSH, ACK] Seq=260498 Ack=2084 Win=24576 Len=2736 TSval=81927610 TSecr=1864127842 [TCP segment of a reassembled PDU]"
"202","3.062381857","104.26.10.104","172.21.0.134","TLSv1.3","2802","Application Data"
"204","3.062624981","104.26.10.104","172.21.0.134","TCP","2802","443  >  44548 [PSH, ACK] Seq=265970 Ack=2084 Win=24576 Len=2736 TSval=81927613 TSecr=1864127842 [TCP segment of a reassembled PDU]"
"207","3.063739994","104.26.10.104","172.21.0.134","TCP","1434","443  >  44548 [ACK] Seq=268706 Ack=2084 Win=24576 Len=1368 TSval=81927615 TSecr=1864127842 [TCP segment of a reassembled PDU]"
"208","3.090220538","104.26.10.104","172.21.0.134","TCP","1434","[TCP Previous segment not captured] 443  >  44548 [ACK] Seq=271442 Ack=2084 Win=24576 Len=1368 TSval=81927617 TSecr=1864127842 [TCP segment of a reassembled PDU]"
"210","3.090761326","104.26.10.104","172.21.0.134","TCP","1434","443  >  44548 [PSH, ACK] Seq=272810 Ack=2084 Win=24576 Len=1368 TSval=81927617 TSecr=1864127842 [TCP segment of a reassembled PDU]"
"212","3.090761678","104.26.10.104","172.21.0.134","TCP","2802","443  >  44548 [PSH, ACK] Seq=274178 Ack=2084 Win=24576 Len=2736 TSval=81927618 TSecr=1864127842 [TCP segment of a reassembled PDU]"
"214","3.090761768","104.26.10.104","172.21.0.134","TCP","2802","443  >  44548 [PSH, ACK] Seq=276914 Ack=2084 Win=24576 Len=2736 TSval=81927620 TSecr=1864127902 [TCP segment of a reassembled PDU]"
"215","3.090761862","104.26.10.104","172.21.0.134","TCP","2802","443  >  44548 [PSH, ACK] Seq=279650 Ack=2084 Win=24576 Len=2736 TSval=81927621 TSecr=1864127904 [TCP segment of a reassembled PDU]"
"216","3.090761949","104.26.10.104","172.21.0.134","TCP","2802","443  >  44548 [PSH, ACK] Seq=282386 Ack=2084 Win=24576 Len=2736 TSval=81927623 TSecr=1864127906 [TCP segment of a reassembled PDU]"
"217","3.090909869","104.26.10.104","172.21.0.134","TCP","1434","443  >  44548 [ACK] Seq=285122 Ack=2084 Win=24576 Len=1368 TSval=81927624 TSecr=1864127906 [TCP segment of a reassembled PDU]"
"218","3.091135193","104.26.10.104","172.21.0.134","TCP","1434","443  >  44548 [PSH, ACK] Seq=286490 Ack=2084 Win=24576 Len=1368 TSval=81927624 TSecr=1864127906 [TCP segment of a reassembled PDU]"
"219","3.091707213","104.26.10.104","172.21.0.134","TCP","1434","443  >  44548 [ACK] Seq=287858 Ack=2084 Win=24576 Len=1368 TSval=81927626 TSecr=1864127908 [TCP segment of a reassembled PDU]"
"221","3.092084097","104.26.10.104","172.21.0.134","TLSv1.3","1434","[TCP Previous segment not captured] , Continuation Data"
"223","3.120967888","104.26.10.104","172.21.0.134","TLSv1.3","1434","Continuation Data"
"224","3.121592994","104.26.10.104","172.21.0.134","TLSv1.3","2802","Continuation Data"
"225","3.121593278","104.26.10.104","172.21.0.134","TLSv1.3","2802","Continuation Data"
"226","3.121593368","104.26.10.104","172.21.0.134","TLSv1.3","2802","Continuation Data"
"227","3.121593460","104.26.10.104","172.21.0.134","TLSv1.3","2802","Continuation Data"
"228","3.121703148","104.26.10.104","172.21.0.134","TLSv1.3","2802","Continuation Data"
"229","3.121782214","104.26.10.104","172.21.0.134","TLSv1.3","1434","Continuation Data"
"231","3.122265760","104.26.10.104","172.21.0.134","TLSv1.3","1434","Continuation Data"
"233","3.124570086","104.26.10.104","172.21.0.134","TCP","1434","[TCP Out-Of-Order] 443  >  44548 [ACK] Seq=293330 Ack=2084 Win=24576 Len=1368 TSval=81927680 TSecr=1864127957 [TCP segment of a reassembled PDU]"
"235","3.152439954","104.26.10.104","172.21.0.134","TCP","1434","[TCP Retransmission] 443  >  44548 [PSH, ACK] Seq=294698 Ack=2084 Win=24576 Len=1368 TSval=81927680 TSecr=1864127957"
"236","3.152999943","104.26.10.104","172.21.0.134","TCP","2802","[TCP Retransmission] 443  >  44548 [PSH, ACK] Seq=296066 Ack=2084 Win=24576 Len=2736 TSval=81927683 TSecr=1864127957"
"237","3.153000136","104.26.10.104","172.21.0.134","TCP","2802","[TCP Retransmission] 443  >  44548 [PSH, ACK] Seq=298802 Ack=2084 Win=24576 Len=2736 TSval=81927686 TSecr=1864127957"
"238","3.153000281","104.26.10.104","172.21.0.134","TCP","2802","[TCP Retransmission] 443  >  44548 [PSH, ACK] Seq=301538 Ack=2084 Win=24576 Len=2736 TSval=81927689 TSecr=1864127957"
"239","3.153000370","104.26.10.104","172.21.0.134","TCP","2802","[TCP Retransmission] 443  >  44548 [PSH, ACK] Seq=304274 Ack=2084 Win=24576 Len=2736 TSval=81927701 TSecr=1864127987"
"240","3.153065161","104.26.10.104","172.21.0.134","TCP","2802","[TCP Retransmission] 443  >  44548 [PSH, ACK] Seq=307010 Ack=2084 Win=24576 Len=2736 TSval=81927703 TSecr=1864127987"
"241","3.153201173","104.26.10.104","172.21.0.134","TCP","1434","[TCP Retransmission] 443  >  44548 [ACK] Seq=309746 Ack=2084 Win=24576 Len=1368 TSval=81927706 TSecr=1864127987"
"243","3.153848394","104.26.10.104","172.21.0.134","TCP","1434","[TCP Retransmission] 443  >  44548 [PSH, ACK] Seq=311114 Ack=2084 Win=24576 Len=1368 TSval=81927706 TSecr=1864127987"
"245","3.184168085","104.26.10.104","172.21.0.134","TCP","1434","[TCP Retransmission] 443  >  44548 [ACK] Seq=315218 Ack=2084 Win=24576 Len=1368 TSval=81927712 TSecr=1864127987"
"246","3.184800834","104.26.10.104","172.21.0.134","TCP","1434","[TCP Retransmission] 443  >  44548 [PSH, ACK] Seq=316586 Ack=2084 Win=24576 Len=1368 TSval=81927712 TSecr=1864127987"
"247","3.184801189","104.26.10.104","172.21.0.134","TCP","2802","[TCP Retransmission] 443  >  44548 [PSH, ACK] Seq=317954 Ack=2084 Win=24576 Len=2736 TSval=81927715 TSecr=1864127987"
"248","3.184801279","104.26.10.104","172.21.0.134","TCP","1434","[TCP Retransmission] 443  >  44548 [ACK] Seq=270074 Ack=2084 Win=24576 Len=1368 TSval=81927718 TSecr=1864127989"
"250","3.184801367","104.26.10.104","172.21.0.134","TCP","1434","[TCP Retransmission] 443  >  44548 [ACK] Seq=289226 Ack=2084 Win=24576 Len=1368 TSval=81927719 TSecr=1864127989"
"252","3.184801459","104.26.10.104","172.21.0.134","TCP","1434","[TCP Retransmission] 443  >  44548 [ACK] Seq=290594 Ack=2084 Win=24576 Len=1368 TSval=81927721 TSecr=1864127989"
"254","3.184801547","104.26.10.104","172.21.0.134","TCP","1434","[TCP Retransmission] 443  >  44548 [ACK] Seq=291962 Ack=2084 Win=24576 Len=1368 TSval=81927733 TSecr=1864128018"
"255","3.184801638","104.26.10.104","172.21.0.134","TCP","2802","[TCP Retransmission] 443  >  44548 [PSH, ACK] Seq=320690 Ack=2084 Win=24576 Len=2736 TSval=81927734 TSecr=1864128018"
"256","3.184982007","104.26.10.104","172.21.0.134","TCP","1434","[TCP Retransmission] 443  >  44548 [ACK] Seq=323426 Ack=2084 Win=24576 Len=1368 TSval=81927737 TSecr=1864128018"
"260","3.185133765","104.26.10.104","172.21.0.134","TCP","1434","[TCP Retransmission] 443  >  44548 [PSH, ACK] Seq=324794 Ack=2084 Win=24576 Len=1368 TSval=81927737 TSecr=1864128018"
"261","3.185133972","104.26.10.104","172.21.0.134","TCP","1434","[TCP Retransmission] 443  >  44548 [ACK] Seq=326162 Ack=2084 Win=24576 Len=1368 TSval=81927740 TSecr=1864128018"
"263","3.187489019","104.26.10.104","172.21.0.134","TLSv1.3","1434","Continuation Data"
"265","3.214887996","104.26.10.104","172.21.0.134","TLSv1.3","1434","Continuation Data"
"266","3.215482169","104.26.10.104","172.21.0.134","TLSv1.3","2802","Continuation Data"
"267","3.215482473","104.26.10.104","172.21.0.134","TLSv1.3","2802","Continuation Data"
"268","3.215482565","104.26.10.104","172.21.0.134","TLSv1.3","2802","Continuation Data"
"269","3.215482653","104.26.10.104","172.21.0.134","TLSv1.3","2802","Continuation Data"
"270","3.215556482","104.26.10.104","172.21.0.134","TLSv1.3","1434","Continuation Data"
"271","3.215556624","104.26.10.104","172.21.0.134","TLSv1.3","1434","Continuation Data"
"272","3.215700933","104.26.10.104","172.21.0.134","TLSv1.3","1434","Continuation Data"
"274","3.216380424","104.26.10.104","172.21.0.134","TLSv1.3","1434","Continuation Data"
"276","3.246767471","104.26.10.104","172.21.0.134","TLSv1.3","1434","[TCP Previous segment not captured] , Continuation Data"
"278","3.248688116","104.26.10.104","172.21.0.134","TLSv1.3","1434","Continuation Data"
"279","3.248688549","104.26.10.104","172.21.0.134","TCP","1434","[TCP Out-Of-Order] 443  >  44548 [ACK] Seq=327530 Ack=2084 Win=24576 Len=1368 TSval=81927777 TSecr=1864128052"
"280","3.248688691","104.26.10.104","172.21.0.134","TLSv1.3","2802","Continuation Data"
"281","3.248688799","104.26.10.104","172.21.0.134","TLSv1.3","2802","Continuation Data"
"282","3.248688950","104.26.10.104","172.21.0.134","TLSv1.3","2802","Continuation Data"
"283","3.248810950","104.26.10.104","172.21.0.134","TLSv1.3","2802","Continuation Data"
"284","3.249848014","104.26.10.104","172.21.0.134","TLSv1.3","1434","Continuation Data"
"286","3.251765577","104.26.10.104","172.21.0.134","TLSv1.3","1434","Continuation Data"
"288","3.253099732","104.26.10.104","172.21.0.134","TLSv1.3","1434","[TCP Previous segment not captured] , Continuation Data"
"290","3.343457572","104.26.10.104","172.21.0.134","TLSv1.3","1434","Continuation Data"
"292","3.349922803","104.26.10.104","172.21.0.134","TLSv1.3","2802","Continuation Data"
"293","3.349923162","104.26.10.104","172.21.0.134","TLSv1.3","2802","Continuation Data"
"294","3.349923253","104.26.10.104","172.21.0.134","TLSv1.3","2802","Continuation Data"
"295","3.349923344","104.26.10.104","172.21.0.134","TLSv1.3","2802","Continuation Data"
"296","3.350015550","104.26.10.104","172.21.0.134","TLSv1.3","2802","Continuation Data"
"297","3.350015687","104.26.10.104","172.21.0.134","TLSv1.3","2802","Continuation Data"
"298","3.350015779","104.26.10.104","172.21.0.134","TCP","1434","[TCP Out-Of-Order] 443  >  44548 [PSH, ACK] Seq=368570 Ack=2084 Win=24576 Len=1368 TSval=81927838 TSecr=1864128112"
"300","3.350015870","104.26.10.104","172.21.0.134","TCP","1434","[TCP Out-Of-Order] 443  >  44548 [ACK] Seq=369938 Ack=2084 Win=24576 Len=1368 TSval=81927841 TSecr=1864128115"
"301","3.350015961","104.26.10.104","172.21.0.134","TCP","1434","[TCP Out-Of-Order] 443  >  44548 [ACK] Seq=312482 Ack=2084 Win=24576 Len=1368 TSval=81927835 TSecr=1864128112"
"303","3.350016050","104.26.10.104","172.21.0.134","TCP","1434","[TCP Out-Of-Order] 443  >  44548 [PSH, ACK] Seq=371306 Ack=2084 Win=24576 Len=1368 TSval=81927841 TSecr=1864128115"
"305","3.350160821","104.26.10.104","172.21.0.134","TCP","1434","[TCP Out-Of-Order] 443  >  44548 [PSH, ACK] Seq=313850 Ack=2084 Win=24576 Len=1368 TSval=81927835 TSecr=1864128112"
"307","3.350160941","104.26.10.104","172.21.0.134","TCP","1434","[TCP Out-Of-Order] 443  >  44548 [ACK] Seq=372674 Ack=2084 Win=24576 Len=1368 TSval=81927844 TSecr=1864128118"
"309","3.350161066","104.26.10.104","172.21.0.134","TCP","1434","[TCP Out-Of-Order] 443  >  44548 [ACK] Seq=367202 Ack=2084 Win=24576 Len=1368 TSval=81927838 TSecr=1864128112"
"311","3.350161156","104.26.10.104","172.21.0.134","TCP","2802","[TCP Out-Of-Order] 443  >  44548 [PSH, ACK] Seq=390458 Ack=2084 Win=24576 Len=2736 TSval=81927846 TSecr=1864128118"
"313","3.350161250","104.26.10.104","172.21.0.134","TCP","2802","[TCP Out-Of-Order] 443  >  44548 [PSH, ACK] Seq=393194 Ack=2084 Win=24576 Len=2736 TSval=81927849 TSecr=1864128118"
"315","3.350161337","104.26.10.104","172.21.0.134","TCP","2802","[TCP Out-Of-Order] 443  >  44548 [PSH, ACK] Seq=395930 Ack=2084 Win=24576 Len=2736 TSval=81927852 TSecr=1864128118"
"317","3.350289789","104.26.10.104","172.21.0.134","TLSv1.3","2802","[TCP Previous segment not captured] , Continuation Data"
"319","3.352936642","104.26.10.104","172.21.0.134","TLSv1.3","1434","Continuation Data"
"321","3.366991585","104.26.10.104","172.21.0.134","TLSv1.3","1434","Continuation Data"
"323","3.368890011","104.26.10.104","172.21.0.134","TLSv1.3","1434","Continuation Data"
"325","3.371934989","104.26.10.104","172.21.0.134","TLSv1.3","1434","Continuation Data"
"326","3.372617033","104.26.10.104","172.21.0.134","TLSv1.3","1434","Continuation Data"
"328","3.373152810","104.26.10.104","172.21.0.134","TLSv1.3","1434","Continuation Data"
"330","3.374524291","104.26.10.104","172.21.0.134","TLSv1.3","1434","Continuation Data"
"332","3.376466891","104.26.10.104","172.21.0.134","TCP","1434","[TCP Spurious Retransmission] 443  >  44548 [ACK] Seq=313850 Ack=2084 Win=24576 Len=1368 TSval=81927933 TSecr=1864128215"
"334","3.376857566","104.26.10.104","172.21.0.134","TCP","1434","[TCP Out-Of-Order] 443  >  44548 [ACK] Seq=420554 Ack=2084 Win=24576 Len=1368 TSval=81927934 TSecr=1864128215"
"336","3.379069347","104.26.10.104","172.21.0.134","TCP","1434","[TCP Out-Of-Order] 443  >  44548 [PSH, ACK] Seq=421922 Ack=2084 Win=24576 Len=1368 TSval=81927934 TSecr=1864128215"
"338","3.379488221","104.26.10.104","172.21.0.134","TCP","1434","[TCP Out-Of-Order] 443  >  44548 [ACK] Seq=423290 Ack=2084 Win=24576 Len=1368 TSval=81927936 TSecr=1864128215"
"340","3.380434042","104.26.10.104","172.21.0.134","TCP","1434","[TCP Out-Of-Order] 443  >  44548 [PSH, ACK] Seq=424658 Ack=2084 Win=24576 Len=1368 TSval=81927936 TSecr=1864128215"
"342","3.381538796","104.26.10.104","172.21.0.134","TCP","1434","[TCP Out-Of-Order] 443  >  44548 [ACK] Seq=426026 Ack=2084 Win=24576 Len=1368 TSval=81927939 TSecr=1864128215"
"344","3.389077716","104.26.10.104","172.21.0.134","TCP","1434","[TCP Out-Of-Order] 443  >  44548 [PSH, ACK] Seq=427394 Ack=2084 Win=24576 Len=1368 TSval=81927939 TSecr=1864128215"
"346","3.389486443","104.26.10.104","172.21.0.134","TLSv1.3","2802","[TCP Fast Retransmission] , Continuation Data"
"348","3.390187292","104.26.10.104","172.21.0.134","TCP","1434","[TCP Out-Of-Order] 443  >  44548 [ACK] Seq=428762 Ack=2084 Win=24576 Len=1368 TSval=81927943 TSecr=1864128218"
"350","3.402466319","104.26.10.104","172.21.0.134","TCP","1434","[TCP Retransmission] 443  >  44548 [PSH, ACK] Seq=430130 Ack=2084 Win=24576 Len=1368 TSval=81927943 TSecr=1864128218"
"352","3.403037300","104.26.10.104","172.21.0.134","TCP","2802","[TCP Retransmission] 443  >  44548 [PSH, ACK] Seq=431498 Ack=2084 Win=24576 Len=2736 TSval=81927946 TSecr=1864128218"
"354","3.403037584","104.26.10.104","172.21.0.134","TCP","2802","[TCP Retransmission] 443  >  44548 [PSH, ACK] Seq=434234 Ack=2084 Win=24576 Len=2736 TSval=81927948 TSecr=1864128218"
"356","3.403037683","104.26.10.104","172.21.0.134","TLSv1.3","2802","Continuation Data"
"358","3.403037791","104.26.10.104","172.21.0.134","TLSv1.3","2802","Continuation Data"
"360","3.403201405","104.26.10.104","172.21.0.134","TLSv1.3","2802","Continuation Data"
"362","3.403773133","104.26.10.104","172.21.0.134","TLSv1.3","1434","Continuation Data"
"364","3.404546716","104.26.10.104","172.21.0.134","TLSv1.3","1434","Continuation Data"
"366","3.404916080","104.26.10.104","172.21.0.134","TLSv1.3","1434","Continuation Data"
"368","3.433386004","104.26.10.104","172.21.0.134","TLSv1.3","1434","Continuation Data"
"370","3.434077949","104.26.10.104","172.21.0.134","TLSv1.3","2802","Continuation Data"
"372","3.434078240","104.26.10.104","172.21.0.134","TLSv1.3","2802","Continuation Data"
"374","3.434078328","104.26.10.104","172.21.0.134","TLSv1.3","2802","Continuation Data"
"376","3.434078418","104.26.10.104","172.21.0.134","TLSv1.3","2802","Continuation Data"
"378","3.434238275","104.26.10.104","172.21.0.134","TLSv1.3","2802","Continuation Data"
"380","3.434473659","104.26.10.104","172.21.0.134","TLSv1.3","1434","Continuation Data"
"382","3.435541497","104.26.10.104","172.21.0.134","TLSv1.3","1434","Continuation Data"
"384","3.465002400","104.26.10.104","172.21.0.134","TLSv1.3","1434","[TCP Previous segment not captured] , Continuation Data"
"386","3.465457187","104.26.10.104","172.21.0.134","TLSv1.3","1434","Continuation Data"
"388","3.465457496","104.26.10.104","172.21.0.134","TLSv1.3","2802","Continuation Data"
"390","3.465457584","104.26.10.104","172.21.0.134","TLSv1.3","2802","Continuation Data"
"392","3.465457674","104.26.10.104","172.21.0.134","TLSv1.3","2802","Continuation Data"
"394","3.466323548","104.26.10.104","172.21.0.134","TLSv1.3","1434","Continuation Data"
"396","3.466929367","104.26.10.104","172.21.0.134","TLSv1.3","359","Continuation Data"
"398","3.487799195","104.26.10.104","172.21.0.134","TCP","1434","[TCP Out-Of-Order] 443  >  44548 [ACK] Seq=479378 Ack=2084 Win=24576 Len=1368 TSval=81928044 TSecr=1864128330"
"400","3.488128080","104.26.10.104","172.21.0.134","TCP","1434","[TCP Out-Of-Order] 443  >  44548 [ACK] Seq=480746 Ack=2084 Win=24576 Len=1368 TSval=81928045 TSecr=1864128330"
"402","3.488983242","104.26.10.104","172.21.0.134","TCP","1434","[TCP Out-Of-Order] 443  >  44548 [ACK] Seq=482114 Ack=2084 Win=24576 Len=1368 TSval=81928046 TSecr=1864128330"
"404","3.489858592","104.26.10.104","172.21.0.134","TCP","1434","[TCP Out-Of-Order] 443  >  44548 [PSH, ACK] Seq=483482 Ack=2084 Win=24576 Len=1368 TSval=81928046 TSecr=1864128330"
"406","3.491687609","104.26.10.104","172.21.0.134","TCP","1434","[TCP Retransmission] 443  >  44548 [ACK] Seq=484850 Ack=2084 Win=24576 Len=1368 TSval=81928049 TSecr=1864128330"
"408","3.495667659","104.26.10.104","172.21.0.134","TCP","1434","[TCP Retransmission] 443  >  44548 [PSH, ACK] Seq=486218 Ack=2084 Win=24576 Len=1368 TSval=81928049 TSecr=1864128330"
"410","3.495979712","104.26.10.104","172.21.0.134","TCP","1434","[TCP Retransmission] 443  >  44548 [ACK] Seq=487586 Ack=2084 Win=24576 Len=1368 TSval=81928051 TSecr=1864128330"
"412","3.497200599","104.26.10.104","172.21.0.134","TCP","1434","[TCP Retransmission] 443  >  44548 [PSH, ACK] Seq=488954 Ack=2084 Win=24576 Len=1368 TSval=81928051 TSecr=1864128330"
"414","3.497809147","104.26.10.104","172.21.0.134","TCP","1434","[TCP Retransmission] 443  >  44548 [ACK] Seq=490322 Ack=2084 Win=24576 Len=1368 TSval=81928054 TSecr=1864128331"
"416","3.499469058","104.26.10.104","172.21.0.134","TCP","1434","[TCP Retransmission] 443  >  44548 [ACK] Seq=491690 Ack=2084 Win=24576 Len=1368 TSval=81928055 TSecr=1864128332"
"419","5.987781576","104.26.10.104","172.21.0.134","TLSv1.3","399","Application Data"
"421","5.988129675","104.26.10.104","172.21.0.134","TCP","1434","443  >  44548 [ACK] Seq=505996 Ack=2305 Win=24576 Len=1368 TSval=81930544 TSecr=1864130790 [TCP segment of a reassembled PDU]"
"423","5.988572326","104.26.10.104","172.21.0.134","TCP","1434","443  >  44548 [PSH, ACK] Seq=507364 Ack=2305 Win=24576 Len=1368 TSval=81930544 TSecr=1864130790 [TCP segment of a reassembled PDU]"
"425","5.989771218","104.26.10.104","172.21.0.134","TCP","1434","443  >  44548 [ACK] Seq=508732 Ack=2305 Win=24576 Len=1368 TSval=81930547 TSecr=1864130790 [TCP segment of a reassembled PDU]"
"427","5.991693513","104.26.10.104","172.21.0.134","TCP","1434","443  >  44548 [PSH, ACK] Seq=510100 Ack=2305 Win=24576 Len=1368 TSval=81930547 TSecr=1864130790 [TCP segment of a reassembled PDU]"
"429","5.992288856","104.26.10.104","172.21.0.134","TCP","1434","443  >  44548 [ACK] Seq=511468 Ack=2305 Win=24576 Len=1368 TSval=81930550 TSecr=1864130790 [TCP segment of a reassembled PDU]"
"431","5.993719846","104.26.10.104","172.21.0.134","TCP","1434","443  >  44548 [PSH, ACK] Seq=512836 Ack=2305 Win=24576 Len=1368 TSval=81930550 TSecr=1864130790 [TCP segment of a reassembled PDU]"
"433","5.994822247","104.26.10.104","172.21.0.134","TCP","1434","443  >  44548 [ACK] Seq=514204 Ack=2305 Win=24576 Len=1368 TSval=81930552 TSecr=1864130790 [TCP segment of a reassembled PDU]"
"435","5.995635327","104.26.10.104","172.21.0.134","TCP","1434","443  >  44548 [PSH, ACK] Seq=515572 Ack=2305 Win=24576 Len=1368 TSval=81930552 TSecr=1864130790 [TCP segment of a reassembled PDU]"
"437","5.997462144","104.26.10.104","172.21.0.134","TCP","1434","443  >  44548 [ACK] Seq=516940 Ack=2305 Win=24576 Len=1368 TSval=81930555 TSecr=1864130790 [TCP segment of a reassembled PDU]"
"439","5.998047346","104.26.10.104","172.21.0.134","TCP","1434","443  >  44548 [PSH, ACK] Seq=518308 Ack=2305 Win=24576 Len=1368 TSval=81930555 TSecr=1864130790 [TCP segment of a reassembled PDU]"
"441","5.999978314","104.26.10.104","172.21.0.134","TCP","1434","443  >  44548 [ACK] Seq=519676 Ack=2305 Win=24576 Len=1368 TSval=81930557 TSecr=1864130790 [TCP segment of a reassembled PDU]"
"443","6.001891905","104.26.10.104","172.21.0.134","TLSv1.3","1434","Application Data"
"445","6.002556781","104.26.10.104","172.21.0.134","TCP","1434","443  >  44548 [ACK] Seq=522412 Ack=2305 Win=24576 Len=1368 TSval=81930560 TSecr=1864130790 [TCP segment of a reassembled PDU]"
"447","6.003488877","104.26.10.104","172.21.0.134","TCP","1434","443  >  44548 [PSH, ACK] Seq=523780 Ack=2305 Win=24576 Len=1368 TSval=81930560 TSecr=1864130790 [TCP segment of a reassembled PDU]"
"449","6.004981104","104.26.10.104","172.21.0.134","TCP","1434","443  >  44548 [ACK] Seq=525148 Ack=2305 Win=24576 Len=1368 TSval=81930562 TSecr=1864130790 [TCP segment of a reassembled PDU]"
"451","6.005235018","104.26.10.104","172.21.0.134","TCP","1434","443  >  44548 [PSH, ACK] Seq=526516 Ack=2305 Win=24576 Len=1368 TSval=81930562 TSecr=1864130790 [TCP segment of a reassembled PDU]"
"453","6.007574439","104.26.10.104","172.21.0.134","TCP","1434","443  >  44548 [ACK] Seq=527884 Ack=2305 Win=24576 Len=1368 TSval=81930565 TSecr=1864130790 [TCP segment of a reassembled PDU]"
"455","6.009331044","104.26.10.104","172.21.0.134","TCP","1434","443  >  44548 [PSH, ACK] Seq=529252 Ack=2305 Win=24576 Len=1368 TSval=81930565 TSecr=1864130790 [TCP segment of a reassembled PDU]"
"457","6.010021087","104.26.10.104","172.21.0.134","TCP","1434","443  >  44548 [ACK] Seq=530620 Ack=2305 Win=24576 Len=1368 TSval=81930567 TSecr=1864130790 [TCP segment of a reassembled PDU]"
"459","6.011370940","104.26.10.104","172.21.0.134","TCP","1434","443  >  44548 [PSH, ACK] Seq=531988 Ack=2305 Win=24576 Len=1368 TSval=81930567 TSecr=1864130790 [TCP segment of a reassembled PDU]"
"461","6.012557683","104.26.10.104","172.21.0.134","TCP","1434","443  >  44548 [ACK] Seq=533356 Ack=2305 Win=24576 Len=1368 TSval=81930570 TSecr=1864130790 [TCP segment of a reassembled PDU]"
"463","6.013277678","104.26.10.104","172.21.0.134","TCP","1434","443  >  44548 [PSH, ACK] Seq=534724 Ack=2305 Win=24576 Len=1368 TSval=81930570 TSecr=1864130790 [TCP segment of a reassembled PDU]"
"465","6.026967486","104.26.10.104","172.21.0.134","TCP","1434","443  >  44548 [ACK] Seq=536092 Ack=2305 Win=24576 Len=1368 TSval=81930572 TSecr=1864130853 [TCP segment of a reassembled PDU]"
"467","6.027464288","104.26.10.104","172.21.0.134","TLSv1.3","1434","Application Data"
