"No.","Time","Source","Destination","Protocol","Length","Info"
"6","3.237782186","172.21.0.134","34.107.221.82","TCP","66","44110  >  80 [ACK] Seq=1 Ack=1 Win=501 Len=0 TSval=2472576254 TSecr=3817124735"
"7","3.238722198","172.21.0.134","34.107.221.82","TCP","66","44108  >  80 [ACK] Seq=1 Ack=1 Win=501 Len=0 TSval=2472576255 TSecr=3784173459"
"8","3.239807521","54.227.95.54","172.21.0.134","TLSv1.2","90","Application Data"
"9","3.240100868","172.21.0.134","54.227.95.54","TLSv1.2","94","Application Data"
"10","3.261810427","34.107.221.82","172.21.0.134","TCP","66","[TCP ACKed unseen segment] 80  >  44110 [ACK] Seq=1 Ack=2 Win=277 Len=0 TSval=3817134976 TSecr=2472545490"
"11","3.263621197","34.107.221.82","172.21.0.134","TCP","66","[TCP ACKed unseen segment] 80  >  44108 [ACK] Seq=1 Ack=2 Win=277 Len=0 TSval=3784183699 TSecr=2472545461"
"12","3.361516667","54.227.95.54","172.21.0.134","TCP","66","443  >  51174 [ACK] Seq=25 Ack=29 Win=534 Len=0 TSval=96106933 TSecr=965903573"
"26","8.357794515","172.21.0.134","204.79.197.239","TCP","54","58090  >  443 [ACK] Seq=1 Ack=1 Win=501 Len=0"
"27","8.369522895","204.79.197.239","172.21.0.134","TCP","60","[TCP ACKed unseen segment] 443  >  58090 [ACK] Seq=1 Ack=2 Win=16387 Len=0"
"29","8.909645507","172.21.0.134","52.108.8.12","TLSv1.2","93","Application Data"
"30","8.926331762","52.108.8.12","172.21.0.134","TCP","60","443  >  38614 [ACK] Seq=1 Ack=40 Win=16386 Len=0"
"31","8.926332354","52.108.8.12","172.21.0.134","TLSv1.2","93","Application Data"
"32","8.926446267","172.21.0.134","52.108.8.12","TCP","54","38614  >  443 [ACK] Seq=40 Ack=40 Win=501 Len=0"
"35","11.605648751","172.21.0.134","213.147.96.51","DNS","79","Standard query 0xa5e5 A lrod.an32fd1b3.site"
"36","11.605912803","172.21.0.134","213.147.96.51","DNS","79","Standard query 0x3e22 AAAA lrod.an32fd1b3.site"
"37","11.680571864","213.147.96.51","172.21.0.134","DNS","163","Standard query response 0x3e22 AAAA lrod.an32fd1b3.site AAAA 2606:4700:20::681a:b68 AAAA 2606:4700:20::ac43:4a75 AAAA 2606:4700:20::681a:a68"
"38","11.680571798","213.147.96.51","172.21.0.134","DNS","127","Standard query response 0xa5e5 A lrod.an32fd1b3.site A 104.26.10.104 A 172.67.74.117 A 104.26.11.104"
"39","11.686004352","172.21.0.134","104.26.10.104","TCP","74","44548  >  443 [SYN] Seq=0 Win=64240 Len=0 MSS=1460 SACK_PERM TSval=1864124865 TSecr=0 WS=128"
"40","11.709142950","104.26.10.104","172.21.0.134","TCP","74","443  >  44548 [SYN, ACK] Seq=0 Ack=1 Win=65160 Len=0 MSS=1380 SACK_PERM TSval=81924579 TSecr=1864124865 WS=8192"
"41","11.709274684","172.21.0.134","104.26.10.104","TCP","66","44548  >  443 [ACK] Seq=1 Ack=1 Win=64256 Len=0 TSval=1864124888 TSecr=81924579"
"42","11.714399044","172.21.0.134","104.26.10.104","TLSv1.3","733","Client Hello"
"43","11.740467044","104.26.10.104","172.21.0.134","TCP","66","443  >  44548 [ACK] Seq=1 Ack=668 Win=24576 Len=0 TSval=81924608 TSecr=1864124893"
"44","11.742276326","104.26.10.104","172.21.0.134","TLSv1.3","1434","Server Hello, Change Cipher Spec"
"45","11.742364995","172.21.0.134","104.26.10.104","TCP","66","44548  >  443 [ACK] Seq=668 Ack=1369 Win=63104 Len=0 TSval=1864124921 TSecr=81924613"
"46","11.743234443","104.26.10.104","172.21.0.134","TCP","1434","443  >  44548 [ACK] Seq=1369 Ack=668 Win=24576 Len=1368 TSval=81924613 TSecr=1864124893 [TCP segment of a reassembled PDU]"
"47","11.743289851","172.21.0.134","104.26.10.104","TCP","66","44548  >  443 [ACK] Seq=668 Ack=2737 Win=61824 Len=0 TSval=1864124922 TSecr=81924613"
"48","11.743601623","104.26.10.104","172.21.0.134","TCP","1434","443  >  44548 [ACK] Seq=2737 Ack=668 Win=24576 Len=1368 TSval=81924613 TSecr=1864124893 [TCP segment of a reassembled PDU]"
"49","11.743647532","172.21.0.134","104.26.10.104","TCP","66","44548  >  443 [ACK] Seq=668 Ack=4105 Win=60544 Len=0 TSval=1864124922 TSecr=81924613"
"50","11.744612172","104.26.10.104","172.21.0.134","TLSv1.3","1216","Application Data"
"51","11.744673394","172.21.0.134","104.26.10.104","TCP","66","44548  >  443 [ACK] Seq=668 Ack=5255 Win=63104 Len=0 TSval=1864124923 TSecr=81924613"
"52","11.770507128","172.21.0.134","104.26.10.104","TLSv1.3","130","Change Cipher Spec, Application Data"
"53","11.771770730","172.21.0.134","104.26.10.104","TLSv1.3","236","Application Data"
"54","11.771858963","172.21.0.134","104.26.10.104","TLSv1.3","483","Application Data"
"55","11.794286256","104.26.10.104","172.21.0.134","TLSv1.3","578","Application Data, Application Data"
"56","11.794886499","104.26.10.104","172.21.0.134","TLSv1.3","97","Application Data"
"57","11.796557187","172.21.0.134","104.26.10.104","TLSv1.3","97","Application Data"
"58","11.818385332","104.26.10.104","172.21.0.134","TCP","66","443  >  44548 [ACK] Seq=5798 Ack=1350 Win=24576 Len=0 TSval=81924689 TSecr=1864124951"
"59","11.836318196","104.26.10.104","172.21.0.134","TLSv1.3","582","Application Data"
"60","11.836981805","104.26.10.104","172.21.0.134","TLSv1.3","1457","Application Data"
"61","11.836982110","104.26.10.104","172.21.0.134","TLSv1.3","2848","Application Data, Application Data"
"62","11.836982205","104.26.10.104","172.21.0.134","TLSv1.3","11010","Application Data, Application Data, Application Data, Application Data, Application Data, Application Data, Application Data"
"63","11.837061523","172.21.0.134","104.26.10.104","TCP","66","44548  >  443 [ACK] Seq=1350 Ack=7705 Win=62336 Len=0 TSval=1864125016 TSecr=81924707"
"64","11.837140086","172.21.0.134","104.26.10.104","TCP","66","44548  >  443 [ACK] Seq=1350 Ack=21431 Win=48640 Len=0 TSval=1864125016 TSecr=81924707"
"65","11.837190045","104.26.10.104","172.21.0.134","TLSv1.3","1434","Application Data"
"66","11.838502738","104.26.10.104","172.21.0.134","TLSv1.3","1434","Application Data"
"67","11.838556076","172.21.0.134","104.26.10.104","TCP","66","44548  >  443 [ACK] Seq=1350 Ack=24167 Win=63104 Len=0 TSval=1864125017 TSecr=81924707"
"68","11.839148783","104.26.10.104","172.21.0.134","TLSv1.3","7251","Application Data, Application Data, Application Data, Application Data, Application Data, Application Data"
"69","11.839149203","104.26.10.104","172.21.0.134","TLSv1.3","9642","Application Data, Application Data, Application Data, Application Data, Application Data, Application Data, Application Data"
"70","11.839302712","172.21.0.134","104.26.10.104","TCP","66","44548  >  443 [ACK] Seq=1350 Ack=40928 Win=46464 Len=0 TSval=1864125018 TSecr=81924707"
"71","11.840027758","104.26.10.104","172.21.0.134","TLSv1.3","1434","[TCP Previous segment not captured] , Continuation Data"
"72","11.840074434","172.21.0.134","104.26.10.104","TCP","78","[TCP Window Update] 44548  >  443 [ACK] Seq=1350 Ack=40928 Win=48256 Len=0 TSval=1864125019 TSecr=81924707 SLE=50504 SRE=51872"
"73","11.840390380","104.26.10.104","172.21.0.134","TLSv1.3","1434","Continuation Data"
"74","11.840427197","172.21.0.134","104.26.10.104","TCP","78","[TCP Window Update] 44548  >  443 [ACK] Seq=1350 Ack=40928 Win=61056 Len=0 TSval=1864125019 TSecr=81924707 SLE=50504 SRE=53240"
"75","11.870711530","104.26.10.104","172.21.0.134","TLSv1.3","1434","Continuation Data"
"76","11.870796962","172.21.0.134","104.26.10.104","TCP","78","[TCP Dup ACK 70#1] 44548  >  443 [ACK] Seq=1350 Ack=40928 Win=61056 Len=0 TSval=1864125050 TSecr=81924707 SLE=50504 SRE=54608"
"77","11.871401678","104.26.10.104","172.21.0.134","TLSv1.3","5538","Continuation Data"
"78","11.871402001","104.26.10.104","172.21.0.134","TLSv1.3","6906","[TCP Previous segment not captured] , Continuation Data"
"79","11.871461359","104.26.10.104","172.21.0.134","TLSv1.3","1434","[TCP Previous segment not captured] , Continuation Data"
"80","11.871483947","172.21.0.134","104.26.10.104","TCP","86","[TCP Dup ACK 70#2] 44548  >  443 [ACK] Seq=1350 Ack=40928 Win=61056 Len=0 TSval=1864125050 TSecr=81924707 SLE=62816 SRE=69656 SLE=50504 SRE=60080"
"81","11.871692943","104.26.10.104","172.21.0.134","TLSv1.3","1434","Continuation Data"
"82","11.872198362","104.26.10.104","172.21.0.134","TLSv1.3","1434","Continuation Data"
"83","11.872845040","172.21.0.134","104.26.10.104","TCP","94","[TCP Dup ACK 70#3] 44548  >  443 [ACK] Seq=1350 Ack=40928 Win=61056 Len=0 TSval=1864125051 TSecr=81924707 SLE=69926 SRE=74030 SLE=62816 SRE=69656 SLE=50504 SRE=60080"
"84","11.901245597","104.26.10.104","172.21.0.134","TCP","1434","[TCP Retransmission] 443  >  44548 [ACK] Seq=40928 Ack=1350 Win=24576 Len=1368 TSval=81924742 TSecr=1864125019"
"85","11.901331836","172.21.0.134","104.26.10.104","TCP","94","44548  >  443 [ACK] Seq=1350 Ack=42296 Win=59776 Len=0 TSval=1864125080 TSecr=81924742 SLE=69926 SRE=74030 SLE=62816 SRE=69656 SLE=50504 SRE=60080"
"86","11.902784797","104.26.10.104","172.21.0.134","TCP","8274","[TCP Retransmission] 443  >  44548 [PSH, ACK] Seq=42296 Ack=1350 Win=24576 Len=8208 TSval=81924742 TSecr=1864125019"
"87","11.902840551","172.21.0.134","104.26.10.104","TCP","86","44548  >  443 [ACK] Seq=1350 Ack=60080 Win=80512 Len=0 TSval=1864125082 TSecr=81924742 SLE=69926 SRE=74030 SLE=62816 SRE=69656"
"88","11.902785193","104.26.10.104","172.21.0.134","TLSv1.3","5538","[TCP Previous segment not captured] , Continuation Data"
"89","11.902916968","172.21.0.134","104.26.10.104","TCP","94","[TCP Window Update] 44548  >  443 [ACK] Seq=1350 Ack=60080 Win=91520 Len=0 TSval=1864125082 TSecr=81924742 SLE=89184 SRE=94656 SLE=69926 SRE=74030 SLE=62816 SRE=69656"
"90","11.903076044","104.26.10.104","172.21.0.134","TLSv1.3","1434","Continuation Data"
"91","11.903100303","172.21.0.134","104.26.10.104","TCP","94","[TCP Window Update] 44548  >  443 [ACK] Seq=1350 Ack=60080 Win=94208 Len=0 TSval=1864125082 TSecr=81924742 SLE=89184 SRE=96024 SLE=69926 SRE=74030 SLE=62816 SRE=69656"
"92","11.904190202","104.26.10.104","172.21.0.134","TLSv1.3","1434","Continuation Data"
"93","11.904250482","172.21.0.134","104.26.10.104","TCP","94","[TCP Window Update] 44548  >  443 [ACK] Seq=1350 Ack=60080 Win=97024 Len=0 TSval=1864125083 TSecr=81924742 SLE=89184 SRE=97392 SLE=69926 SRE=74030 SLE=62816 SRE=69656"
"94","11.924722878","104.26.10.104","172.21.0.134","TCP","1434","[TCP Out-Of-Order] 443  >  44548 [ACK] Seq=74030 Ack=1350 Win=24576 Len=1368 TSval=81924795 TSecr=1864125080"
"95","11.925976811","172.21.0.134","104.26.10.104","TCP","94","[TCP Window Update] 44548  >  443 [ACK] Seq=1350 Ack=60080 Win=99712 Len=0 TSval=1864125104 TSecr=81924742 SLE=69926 SRE=75398 SLE=89184 SRE=97392 SLE=62816 SRE=69656"
"96","11.931681047","104.26.10.104","172.21.0.134","TCP","1434","[TCP Retransmission] 443  >  44548 [ACK] Seq=75398 Ack=1350 Win=24576 Len=1368 TSval=81924795 TSecr=1864125080"
"97","11.932366939","104.26.10.104","172.21.0.134","TCP","10571","[TCP Retransmission] 443  >  44548 [PSH, ACK] Seq=76766 Ack=1350 Win=24576 Len=10505 TSval=81924795 TSecr=1864125080"
"98","11.932430961","104.26.10.104","172.21.0.134","TCP","1434","[TCP Retransmission] 443  >  44548 [ACK] Seq=87271 Ack=1350 Win=24576 Len=1368 TSval=81924795 TSecr=1864125080"
"99","11.932431148","104.26.10.104","172.21.0.134","TCP","611","[TCP Retransmission] 443  >  44548 [ACK] Seq=88639 Ack=1350 Win=24576 Len=545 TSval=81924796 TSecr=1864125082"
"100","11.932575862","104.26.10.104","172.21.0.134","TLSv1.3","1434","[TCP Previous segment not captured] , Continuation Data"
"101","11.932609093","172.21.0.134","104.26.10.104","TCP","86","[TCP Window Update] 44548  >  443 [ACK] Seq=1350 Ack=60080 Win=128896 Len=0 TSval=1864125111 TSecr=81924742 SLE=69926 SRE=97392 SLE=62816 SRE=69656"
"102","11.933613640","104.26.10.104","172.21.0.134","TLSv1.3","1434","Continuation Data"
"103","11.934777534","172.21.0.134","104.26.10.104","TCP","94","[TCP Window Update] 44548  >  443 [ACK] Seq=1350 Ack=60080 Win=134400 Len=0 TSval=1864125112 TSecr=81924742 SLE=101984 SRE=104720 SLE=69926 SRE=97392 SLE=62816 SRE=69656"
"104","11.949421488","104.26.10.104","172.21.0.134","TCP","1434","[TCP Out-Of-Order] 443  >  44548 [ACK] Seq=60080 Ack=1350 Win=24576 Len=1368 TSval=81924819 TSecr=1864125104"
"105","11.949508221","172.21.0.134","104.26.10.104","TCP","94","44548  >  443 [ACK] Seq=1350 Ack=61448 Win=137088 Len=0 TSval=1864125128 TSecr=81924819 SLE=101984 SRE=104720 SLE=69926 SRE=97392 SLE=62816 SRE=69656"
"106","11.963105636","104.26.10.104","172.21.0.134","TCP","1434","[TCP Retransmission] 443  >  44548 [PSH, ACK] Seq=61448 Ack=1350 Win=24576 Len=1368 TSval=81924819 TSecr=1864125104"
"107","11.963189870","172.21.0.134","104.26.10.104","TCP","86","44548  >  443 [ACK] Seq=1350 Ack=69656 Win=139904 Len=0 TSval=1864125142 TSecr=81924819 SLE=101984 SRE=104720 SLE=69926 SRE=97392"
"108","11.963727811","104.26.10.104","172.21.0.134","TCP","336","[TCP Retransmission] 443  >  44548 [ACK] Seq=69656 Ack=1350 Win=24576 Len=270 TSval=81924825 TSecr=1864125111"
"109","11.963777382","172.21.0.134","104.26.10.104","TCP","78","44548  >  443 [ACK] Seq=1350 Ack=97392 Win=142592 Len=0 TSval=1864125143 TSecr=81924825 SLE=101984 SRE=104720"
"110","11.963728140","104.26.10.104","172.21.0.134","TLSv1.3","12378","[TCP Previous segment not captured] , Continuation Data"
"111","11.963823049","172.21.0.134","104.26.10.104","TCP","86","[TCP Window Update] 44548  >  443 [ACK] Seq=1350 Ack=97392 Win=167296 Len=0 TSval=1864125143 TSecr=81924825 SLE=117032 SRE=129344 SLE=101984 SRE=104720"
"112","11.964045108","104.26.10.104","172.21.0.134","TLSv1.3","1434","Continuation Data"
"113","11.964090937","172.21.0.134","104.26.10.104","TCP","86","[TCP Window Update] 44548  >  443 [ACK] Seq=1350 Ack=97392 Win=169984 Len=0 TSval=1864125143 TSecr=81924825 SLE=117032 SRE=130712 SLE=101984 SRE=104720"
"114","11.964884866","104.26.10.104","172.21.0.134","TLSv1.3","1434","Continuation Data"
"115","11.964944679","172.21.0.134","104.26.10.104","TCP","86","[TCP Window Update] 44548  >  443 [ACK] Seq=1350 Ack=97392 Win=172672 Len=0 TSval=1864125144 TSecr=81924825 SLE=117032 SRE=132080 SLE=101984 SRE=104720"
"116","11.971305447","104.26.10.104","172.21.0.134","TCP","1434","[TCP Out-Of-Order] 443  >  44548 [ACK] Seq=104720 Ack=1350 Win=24576 Len=1368 TSval=81924842 TSecr=1864125128"
"117","11.972511529","172.21.0.134","104.26.10.104","TCP","86","[TCP Window Update] 44548  >  443 [ACK] Seq=1350 Ack=97392 Win=175488 Len=0 TSval=1864125150 TSecr=81924825 SLE=101984 SRE=106088 SLE=117032 SRE=132080"
"118","11.973275866","104.26.10.104","172.21.0.134","TCP","1434","[TCP Out-Of-Order] 443  >  44548 [PSH, ACK] Seq=106088 Ack=1350 Win=24576 Len=1368 TSval=81924842 TSecr=1864125128"
"119","11.974445925","172.21.0.134","104.26.10.104","TCP","86","[TCP Window Update] 44548  >  443 [ACK] Seq=1350 Ack=97392 Win=178176 Len=0 TSval=1864125152 TSecr=81924825 SLE=101984 SRE=107456 SLE=117032 SRE=132080"
"120","11.995007120","104.26.10.104","172.21.0.134","TCP","1434","[TCP Retransmission] 443  >  44548 [ACK] Seq=107456 Ack=1350 Win=24576 Len=1368 TSval=81924856 TSecr=1864125142"
"121","11.995644089","104.26.10.104","172.21.0.134","TCP","1434","[TCP Retransmission] 443  >  44548 [ACK] Seq=108824 Ack=1350 Win=24576 Len=1368 TSval=81924856 TSecr=1864125142"
"122","11.995644560","104.26.10.104","172.21.0.134","TCP","2802","[TCP Retransmission] 443  >  44548 [PSH, ACK] Seq=110192 Ack=1350 Win=24576 Len=2736 TSval=81924857 TSecr=1864125143"
"123","11.995644651","104.26.10.104","172.21.0.134","TCP","4170","[TCP Retransmission] 443  >  44548 [ACK] Seq=112928 Ack=1350 Win=24576 Len=4104 TSval=81924857 TSecr=1864125143"
"124","11.995644743","104.26.10.104","172.21.0.134","TLSv1.3","5538","[TCP Previous segment not captured] , Continuation Data"
"125","11.995919320","104.26.10.104","172.21.0.134","TLSv1.3","1434","Continuation Data"
"126","11.996206756","172.21.0.134","104.26.10.104","TCP","86","[TCP Window Update] 44548  >  443 [ACK] Seq=1350 Ack=97392 Win=211072 Len=0 TSval=1864125175 TSecr=81924825 SLE=145760 SRE=152600 SLE=101984 SRE=132080"
"127","11.996259755","104.26.10.104","172.21.0.134","TLSv1.3","1434","Continuation Data"
"128","11.997399114","172.21.0.134","104.26.10.104","TCP","86","[TCP Window Update] 44548  >  443 [ACK] Seq=1350 Ack=97392 Win=213760 Len=0 TSval=1864125175 TSecr=81924825 SLE=145760 SRE=153968 SLE=101984 SRE=132080"
"129","12.025778630","104.26.10.104","172.21.0.134","TCP","1434","[TCP Retransmission] 443  >  44548 [ACK] Seq=97392 Ack=1350 Win=24576 Len=1368 TSval=81924866 TSecr=1864125150"
"130","12.025865910","172.21.0.134","104.26.10.104","TCP","86","44548  >  443 [ACK] Seq=1350 Ack=98760 Win=216448 Len=0 TSval=1864125205 TSecr=81924866 SLE=145760 SRE=153968 SLE=101984 SRE=132080"
"131","12.026376170","104.26.10.104","172.21.0.134","TCP","1434","[TCP Retransmission] 443  >  44548 [PSH, ACK] Seq=98760 Ack=1350 Win=24576 Len=1368 TSval=81924866 TSecr=1864125150"
"132","12.026450063","172.21.0.134","104.26.10.104","TCP","86","44548  >  443 [ACK] Seq=1350 Ack=100128 Win=219264 Len=0 TSval=1864125205 TSecr=81924866 SLE=145760 SRE=153968 SLE=101984 SRE=132080"
"133","12.026376585","104.26.10.104","172.21.0.134","TCP","1922","[TCP Retransmission] 443  >  44548 [PSH, ACK] Seq=100128 Ack=1350 Win=24576 Len=1856 TSval=81924867 TSecr=1864125152"
"134","12.026513064","172.21.0.134","104.26.10.104","TCP","78","44548  >  443 [ACK] Seq=1350 Ack=132080 Win=222976 Len=0 TSval=1864125205 TSecr=81924867 SLE=145760 SRE=153968"
"135","12.026376680","104.26.10.104","172.21.0.134","TCP","8274","[TCP Retransmission] 443  >  44548 [PSH, ACK] Seq=132080 Ack=1350 Win=24576 Len=8208 TSval=81924889 TSecr=1864125175"
"136","12.026587854","172.21.0.134","104.26.10.104","TCP","78","44548  >  443 [ACK] Seq=1350 Ack=140288 Win=239360 Len=0 TSval=1864125205 TSecr=81924889 SLE=145760 SRE=153968"
"137","12.026588829","104.26.10.104","172.21.0.134","TCP","1434","[TCP Retransmission] 443  >  44548 [ACK] Seq=140288 Ack=1350 Win=24576 Len=1368 TSval=81924889 TSecr=1864125175"
"138","12.026630218","172.21.0.134","104.26.10.104","TCP","78","44548  >  443 [ACK] Seq=1350 Ack=141656 Win=242048 Len=0 TSval=1864125205 TSecr=81924889 SLE=145760 SRE=153968"
"139","12.027955232","104.26.10.104","172.21.0.134","TCP","1434","[TCP Retransmission] 443  >  44548 [ACK] Seq=141656 Ack=1350 Win=24576 Len=1368 TSval=81924889 TSecr=1864125175"
"140","12.028015745","172.21.0.134","104.26.10.104","TCP","78","44548  >  443 [ACK] Seq=1350 Ack=143024 Win=244864 Len=0 TSval=1864125207 TSecr=81924889 SLE=145760 SRE=153968"
"141","12.028286338","104.26.10.104","172.21.0.134","TCP","1434","[TCP Retransmission] 443  >  44548 [ACK] Seq=143024 Ack=1350 Win=24576 Len=1368 TSval=81924889 TSecr=1864125175"
"142","12.028326617","172.21.0.134","104.26.10.104","TCP","78","44548  >  443 [ACK] Seq=1350 Ack=144392 Win=247552 Len=0 TSval=1864125207 TSecr=81924889 SLE=145760 SRE=153968"
"143","12.048746443","104.26.10.104","172.21.0.134","TLSv1.3","1434","Continuation Data"
"144","12.048869308","172.21.0.134","104.26.10.104","TCP","78","[TCP Window Update] 44548  >  443 [ACK] Seq=1350 Ack=144392 Win=250240 Len=0 TSval=1864125228 TSecr=81924889 SLE=145760 SRE=155336"
"145","12.049066402","104.26.10.104","172.21.0.134","TLSv1.3","1434","Continuation Data"
"146","12.049109643","172.21.0.134","104.26.10.104","TCP","78","[TCP Window Update] 44548  >  443 [ACK] Seq=1350 Ack=144392 Win=253056 Len=0 TSval=1864125228 TSecr=81924889 SLE=145760 SRE=156704"
"147","12.057370657","104.26.10.104","172.21.0.134","TLSv1.3","1434","Continuation Data"
"148","12.058027237","104.26.10.104","172.21.0.134","TLSv1.3","1434","Continuation Data"
"149","12.058027565","104.26.10.104","172.21.0.134","TLSv1.3","2802","Continuation Data"
"150","12.058027757","104.26.10.104","172.21.0.134","TLSv1.3","2802","Continuation Data"
"151","12.058027927","104.26.10.104","172.21.0.134","TLSv1.3","4170","Continuation Data"
"152","12.058118606","104.26.10.104","172.21.0.134","TLSv1.3","2802","Continuation Data"
"153","12.058271391","104.26.10.104","172.21.0.134","TLSv1.3","1434","[TCP Previous segment not captured] , Continuation Data"
"154","12.058568426","172.21.0.134","104.26.10.104","TCP","86","[TCP Window Update] 44548  >  443 [ACK] Seq=1350 Ack=144392 Win=285824 Len=0 TSval=1864125237 TSecr=81924889 SLE=193640 SRE=195008 SLE=145760 SRE=171752"
"155","12.058979045","104.26.10.104","172.21.0.134","TCP","1434","443  >  44548 [ACK] Seq=195008 Ack=1350 Win=24576 Len=1368 TSval=81924920 TSecr=1864125205 [TCP segment of a reassembled PDU]"
"156","12.060132727","172.21.0.134","104.26.10.104","TCP","86","[TCP Window Update] 44548  >  443 [ACK] Seq=1350 Ack=144392 Win=288640 Len=0 TSval=1864125238 TSecr=81924889 SLE=193640 SRE=196376 SLE=145760 SRE=171752"
"157","12.088704198","104.26.10.104","172.21.0.134","TCP","1434","[TCP Retransmission] 443  >  44548 [ACK] Seq=144392 Ack=1350 Win=24576 Len=1368 TSval=81924942 TSecr=1864125228"
"158","12.088825203","172.21.0.134","104.26.10.104","TCP","78","44548  >  443 [ACK] Seq=1350 Ack=171752 Win=291328 Len=0 TSval=1864125268 TSecr=81924942 SLE=193640 SRE=196376"
"159","12.089412139","104.26.10.104","172.21.0.134","TCP","4170","[TCP Retransmission] 443  >  44548 [PSH, ACK] Seq=171752 Ack=1350 Win=24576 Len=4104 TSval=81924942 TSecr=1864125228"
"160","12.089470573","172.21.0.134","104.26.10.104","TCP","78","44548  >  443 [ACK] Seq=1350 Ack=175856 Win=299520 Len=0 TSval=1864125268 TSecr=81924942 SLE=193640 SRE=196376"
"161","12.089412489","104.26.10.104","172.21.0.134","TCP","9642","[TCP Retransmission] 443  >  44548 [ACK] Seq=175856 Ack=1350 Win=24576 Len=9576 TSval=81924952 TSecr=1864125237"
"162","12.089519057","172.21.0.134","104.26.10.104","TCP","78","44548  >  443 [ACK] Seq=1350 Ack=185432 Win=318720 Len=0 TSval=1864125268 TSecr=81924952 SLE=193640 SRE=196376"
"163","12.090716509","104.26.10.104","172.21.0.134","TCP","1434","[TCP Retransmission] 443  >  44548 [ACK] Seq=185432 Ack=1350 Win=24576 Len=1368 TSval=81924952 TSecr=1864125237"
"164","12.090760067","172.21.0.134","104.26.10.104","TCP","78","44548  >  443 [ACK] Seq=1350 Ack=186800 Win=321408 Len=0 TSval=1864125270 TSecr=81924952 SLE=193640 SRE=196376"
"165","12.091006281","104.26.10.104","172.21.0.134","TCP","1434","[TCP Retransmission] 443  >  44548 [ACK] Seq=186800 Ack=1350 Win=24576 Len=1368 TSval=81924952 TSecr=1864125237"
"166","12.091034618","172.21.0.134","104.26.10.104","TCP","78","44548  >  443 [ACK] Seq=1350 Ack=188168 Win=324224 Len=0 TSval=1864125270 TSecr=81924952 SLE=193640 SRE=196376"
"167","12.112692889","104.26.10.104","172.21.0.134","TCP","1434","443  >  44548 [ACK] Seq=196376 Ack=1350 Win=24576 Len=1368 TSval=81924982 TSecr=1864125268 [TCP segment of a reassembled PDU]"
"168","12.112770160","172.21.0.134","104.26.10.104","TCP","78","[TCP Window Update] 44548  >  443 [ACK] Seq=1350 Ack=188168 Win=326912 Len=0 TSval=1864125292 TSecr=81924952 SLE=193640 SRE=197744"
"169","12.120014851","104.26.10.104","172.21.0.134","TCP","1434","443  >  44548 [PSH, ACK] Seq=197744 Ack=1350 Win=24576 Len=1368 TSval=81924982 TSecr=1864125268 [TCP segment of a reassembled PDU]"
"170","12.120071337","172.21.0.134","104.26.10.104","TCP","78","[TCP Window Update] 44548  >  443 [ACK] Seq=1350 Ack=188168 Win=329600 Len=0 TSval=1864125299 TSecr=81924952 SLE=193640 SRE=199112"
"171","12.121552381","104.26.10.104","172.21.0.134","TCP","4170","443  >  44548 [PSH, ACK] Seq=199112 Ack=1350 Win=24576 Len=4104 TSval=81924983 TSecr=1864125268 [TCP segment of a reassembled PDU]"
"172","12.121552607","104.26.10.104","172.21.0.134","TCP","2802","443  >  44548 [PSH, ACK] Seq=203216 Ack=1350 Win=24576 Len=2736 TSval=81924983 TSecr=1864125268 [TCP segment of a reassembled PDU]"
"173","12.121552698","104.26.10.104","172.21.0.134","SSLv2","2802","Encrypted Data, Continuation Data"
"174","12.121552789","104.26.10.104","172.21.0.134","TLSv1.3","2802","Continuation Data"
"175","12.121618668","104.26.10.104","172.21.0.134","TCP","1434","[TCP Previous segment not captured] 443  >  44548 [ACK] Seq=229208 Ack=1350 Win=24576 Len=1368 TSval=81924983 TSecr=1864125268"
"176","12.122030093","104.26.10.104","172.21.0.134","TLSv1.3","1434","Continuation Data"
"177","12.122349927","104.26.10.104","172.21.0.134","TLSv1.3","929","Continuation Data"
"178","12.122705854","172.21.0.134","104.26.10.104","TCP","86","[TCP Window Update] 44548  >  443 [ACK] Seq=1350 Ack=188168 Win=362496 Len=0 TSval=1864125301 TSecr=81924952 SLE=229208 SRE=232807 SLE=193640 SRE=211424"
"179","12.134917458","104.26.10.104","172.21.0.134","TCP","1434","[TCP Out-Of-Order] 443  >  44548 [ACK] Seq=188168 Ack=1350 Win=24576 Len=1368 TSval=81925006 TSecr=1864125292"
"180","12.134994767","172.21.0.134","104.26.10.104","TCP","86","44548  >  443 [ACK] Seq=1350 Ack=189536 Win=365184 Len=0 TSval=1864125314 TSecr=81925006 SLE=229208 SRE=232807 SLE=193640 SRE=211424"
"181","12.150555621","104.26.10.104","172.21.0.134","TCP","1434","[TCP Retransmission] 443  >  44548 [PSH, ACK] Seq=189536 Ack=1350 Win=24576 Len=1368 TSval=81925006 TSecr=1864125292"
"182","12.150630730","172.21.0.134","104.26.10.104","TCP","86","44548  >  443 [ACK] Seq=1350 Ack=190904 Win=368000 Len=0 TSval=1864125329 TSecr=81925006 SLE=229208 SRE=232807 SLE=193640 SRE=211424"
"183","12.151094216","104.26.10.104","172.21.0.134","TCP","2802","[TCP Retransmission] 443  >  44548 [PSH, ACK] Seq=190904 Ack=1350 Win=24576 Len=2736 TSval=81925006 TSecr=1864125292"
"184","12.151140920","172.21.0.134","104.26.10.104","TCP","78","44548  >  443 [ACK] Seq=1350 Ack=211424 Win=373376 Len=0 TSval=1864125330 TSecr=81925006 SLE=229208 SRE=232807"
"185","12.151094615","104.26.10.104","172.21.0.134","TCP","2802","[TCP Retransmission] 443  >  44548 [PSH, ACK] Seq=211424 Ack=1350 Win=24576 Len=2736 TSval=81925008 TSecr=1864125292"
"186","12.151182324","172.21.0.134","104.26.10.104","TCP","78","44548  >  443 [ACK] Seq=1350 Ack=214160 Win=378880 Len=0 TSval=1864125330 TSecr=81925008 SLE=229208 SRE=232807"
"187","12.151094761","104.26.10.104","172.21.0.134","TCP","2802","[TCP Retransmission] 443  >  44548 [PSH, ACK] Seq=214160 Ack=1350 Win=24576 Len=2736 TSval=81925009 TSecr=1864125292"
"188","12.151094862","104.26.10.104","172.21.0.134","TCP","2802","[TCP Retransmission] 443  >  44548 [PSH, ACK] Seq=216896 Ack=1350 Win=24576 Len=2736 TSval=81925011 TSecr=1864125292"
"189","12.151226716","104.26.10.104","172.21.0.134","TCP","2802","[TCP Retransmission] 443  >  44548 [PSH, ACK] Seq=219632 Ack=1350 Win=24576 Len=2736 TSval=81925012 TSecr=1864125292"
"190","12.151243316","172.21.0.134","104.26.10.104","TCP","78","44548  >  443 [ACK] Seq=1350 Ack=216896 Win=384384 Len=0 TSval=1864125330 TSecr=81925009 SLE=229208 SRE=232807"
"191","12.151291720","172.21.0.134","104.26.10.104","TCP","78","44548  >  443 [ACK] Seq=1350 Ack=219632 Win=389888 Len=0 TSval=1864125330 TSecr=81925011 SLE=229208 SRE=232807"
"192","12.151314758","172.21.0.134","104.26.10.104","TCP","78","44548  >  443 [ACK] Seq=1350 Ack=222368 Win=395264 Len=0 TSval=1864125330 TSecr=81925012 SLE=229208 SRE=232807"
"193","12.151984645","104.26.10.104","172.21.0.134","TCP","1434","[TCP Retransmission] 443  >  44548 [ACK] Seq=222368 Ack=1350 Win=24576 Len=1368 TSval=81925013 TSecr=1864125292"
"194","12.152023807","172.21.0.134","104.26.10.104","TCP","78","44548  >  443 [ACK] Seq=1350 Ack=223736 Win=398080 Len=0 TSval=1864125331 TSecr=81925013 SLE=229208 SRE=232807"
"195","12.152886707","104.26.10.104","172.21.0.134","TCP","1434","[TCP Retransmission] 443  >  44548 [PSH, ACK] Seq=223736 Ack=1350 Win=24576 Len=1368 TSval=81925013 TSecr=1864125292"
"196","12.152960218","172.21.0.134","104.26.10.104","TCP","78","44548  >  443 [ACK] Seq=1350 Ack=225104 Win=400768 Len=0 TSval=1864125332 TSecr=81925013 SLE=229208 SRE=232807"
"197","12.493540408","104.26.10.104","172.21.0.134","TCP","1434","[TCP Retransmission] 443  >  44548 [PSH, ACK] Seq=225104 Ack=1350 Win=24576 Len=1368 TSval=81925282 TSecr=1864125332"
"198","12.493647988","172.21.0.134","104.26.10.104","TCP","78","44548  >  443 [ACK] Seq=1350 Ack=226472 Win=403456 Len=0 TSval=1864125672 TSecr=81925282 SLE=229208 SRE=232807"
"199","12.515879849","104.26.10.104","172.21.0.134","TCP","1434","[TCP Retransmission] 443  >  44548 [ACK] Seq=226472 Ack=1350 Win=24576 Len=1368 TSval=81925387 TSecr=1864125672"
"200","12.515969494","172.21.0.134","104.26.10.104","TCP","78","44548  >  443 [ACK] Seq=1350 Ack=227840 Win=406272 Len=0 TSval=1864125695 TSecr=81925387 SLE=229208 SRE=232807"
"201","12.517581444","104.26.10.104","172.21.0.134","TCP","1434","[TCP Retransmission] 443  >  44548 [ACK] Seq=227840 Ack=1350 Win=24576 Len=1368 TSval=81925387 TSecr=1864125672"
"202","12.517633645","172.21.0.134","104.26.10.104","TCP","66","44548  >  443 [ACK] Seq=1350 Ack=232807 Win=408960 Len=0 TSval=1864125696 TSecr=81925387"
"203","13.210382270","54.227.95.54","172.21.0.134","TLSv1.2","90","Application Data"
"204","13.210714263","172.21.0.134","54.227.95.54","TLSv1.2","94","Application Data"
"205","13.415164599","54.227.95.54","172.21.0.134","TCP","66","443  >  51174 [ACK] Seq=49 Ack=57 Win=534 Len=0 TSval=96116904 TSecr=965913544"
"206","13.477716024","172.21.0.134","34.107.221.82","TCP","66","[TCP Dup ACK 7#1] 44108  >  80 [ACK] Seq=1 Ack=1 Win=501 Len=0 TSval=2472586494 TSecr=3784183699"
"207","13.477765312","172.21.0.134","34.107.221.82","TCP","66","[TCP Dup ACK 6#1] 44110  >  80 [ACK] Seq=1 Ack=1 Win=501 Len=0 TSval=2472586494 TSecr=3817134976"
"208","13.500649779","34.107.221.82","172.21.0.134","TCP","66","[TCP Dup ACK 10#1] 80  >  44110 [ACK] Seq=1 Ack=2 Win=277 Len=0 TSval=3817145214 TSecr=2472545490"
"209","13.502053370","34.107.221.82","172.21.0.134","TCP","66","[TCP Dup ACK 11#1] 80  >  44108 [ACK] Seq=1 Ack=2 Win=277 Len=0 TSval=3784193938 TSecr=2472545461"
"211","14.513122054","172.21.0.134","104.26.10.104","TLSv1.3","287","Application Data"
"212","14.514690009","172.21.0.134","104.26.10.104","TLSv1.3","101","Application Data"
"213","14.541035498","104.26.10.104","172.21.0.134","TCP","66","443  >  44548 [ACK] Seq=232807 Ack=1606 Win=24576 Len=0 TSval=81927408 TSecr=1864127692"
"214","14.595684620","172.21.0.134","104.26.10.104","TLSv1.3","288","Application Data"
"215","14.596218676","172.21.0.134","104.26.10.104","TLSv1.3","101","Application Data"
"216","14.619675208","104.26.10.104","172.21.0.134","TCP","66","443  >  44548 [ACK] Seq=232807 Ack=1863 Win=24576 Len=0 TSval=81927489 TSecr=1864127774"
"217","14.662797849","172.21.0.134","104.26.10.104","TLSv1.3","287","Application Data"
"218","14.722561117","104.26.10.104","172.21.0.134","TLSv1.3","397","Application Data"
"219","14.722711925","104.26.10.104","172.21.0.134","TCP","1434","443  >  44548 [ACK] Seq=233138 Ack=2084 Win=24576 Len=1368 TSval=81927593 TSecr=1864127842 [TCP segment of a reassembled PDU]"
"220","14.722754253","172.21.0.134","104.26.10.104","TCP","66","44548  >  443 [ACK] Seq=2084 Ack=234506 Win=411776 Len=0 TSval=1864127902 TSecr=81927593"
"221","14.723128868","104.26.10.104","172.21.0.134","TCP","1434","443  >  44548 [PSH, ACK] Seq=234506 Ack=2084 Win=24576 Len=1368 TSval=81927593 TSecr=1864127842 [TCP segment of a reassembled PDU]"
"222","14.723596784","104.26.10.104","172.21.0.134","TCP","1434","443  >  44548 [ACK] Seq=235874 Ack=2084 Win=24576 Len=1368 TSval=81927595 TSecr=1864127842 [TCP segment of a reassembled PDU]"
"223","14.723655954","172.21.0.134","104.26.10.104","TCP","66","44548  >  443 [ACK] Seq=2084 Ack=237242 Win=417152 Len=0 TSval=1864127902 TSecr=81927593"
"224","14.724729018","104.26.10.104","172.21.0.134","TCP","1434","443  >  44548 [PSH, ACK] Seq=237242 Ack=2084 Win=24576 Len=1368 TSval=81927595 TSecr=1864127842 [TCP segment of a reassembled PDU]"
"225","14.725266870","104.26.10.104","172.21.0.134","TCP","1434","443  >  44548 [ACK] Seq=238610 Ack=2084 Win=24576 Len=1368 TSval=81927596 TSecr=1864127842 [TCP segment of a reassembled PDU]"
"226","14.725319933","172.21.0.134","104.26.10.104","TCP","66","44548  >  443 [ACK] Seq=2084 Ack=239978 Win=422656 Len=0 TSval=1864127904 TSecr=81927595"
"227","14.726512365","104.26.10.104","172.21.0.134","TCP","1434","443  >  44548 [PSH, ACK] Seq=239978 Ack=2084 Win=24576 Len=1368 TSval=81927596 TSecr=1864127842 [TCP segment of a reassembled PDU]"
"228","14.726830933","104.26.10.104","172.21.0.134","TCP","1434","443  >  44548 [ACK] Seq=241346 Ack=2084 Win=24576 Len=1368 TSval=81927598 TSecr=1864127842 [TCP segment of a reassembled PDU]"
"229","14.726884945","172.21.0.134","104.26.10.104","TCP","66","44548  >  443 [ACK] Seq=2084 Ack=242714 Win=428160 Len=0 TSval=1864127906 TSecr=81927596"
"230","14.728561458","104.26.10.104","172.21.0.134","TCP","1434","443  >  44548 [PSH, ACK] Seq=242714 Ack=2084 Win=24576 Len=1368 TSval=81927598 TSecr=1864127842 [TCP segment of a reassembled PDU]"
"231","14.729372340","104.26.10.104","172.21.0.134","TCP","1434","443  >  44548 [ACK] Seq=244082 Ack=2084 Win=24576 Len=1368 TSval=81927600 TSecr=1864127842 [TCP segment of a reassembled PDU]"
"232","14.729457678","172.21.0.134","104.26.10.104","TCP","66","44548  >  443 [ACK] Seq=2084 Ack=245450 Win=433664 Len=0 TSval=1864127908 TSecr=81927598"
"233","14.730818186","104.26.10.104","172.21.0.134","TCP","1434","443  >  44548 [PSH, ACK] Seq=245450 Ack=2084 Win=24576 Len=1368 TSval=81927600 TSecr=1864127842 [TCP segment of a reassembled PDU]"
"234","14.731797690","104.26.10.104","172.21.0.134","TCP","1434","443  >  44548 [ACK] Seq=246818 Ack=2084 Win=24576 Len=1368 TSval=81927601 TSecr=1864127842 [TCP segment of a reassembled PDU]"
"235","14.731851159","172.21.0.134","104.26.10.104","TCP","66","44548  >  443 [ACK] Seq=2084 Ack=248186 Win=439040 Len=0 TSval=1864127911 TSecr=81927600"
"236","14.732921243","104.26.10.104","172.21.0.134","TLSv1.3","1434","Application Data"
"237","14.733949353","104.26.10.104","172.21.0.134","TCP","1434","443  >  44548 [ACK] Seq=249554 Ack=2084 Win=24576 Len=1368 TSval=81927603 TSecr=1864127842 [TCP segment of a reassembled PDU]"
"238","14.734033000","172.21.0.134","104.26.10.104","TCP","66","44548  >  443 [ACK] Seq=2084 Ack=250922 Win=444544 Len=0 TSval=1864127913 TSecr=81927601"
"239","14.735227144","104.26.10.104","172.21.0.134","TCP","1434","443  >  44548 [PSH, ACK] Seq=250922 Ack=2084 Win=24576 Len=1368 TSval=81927603 TSecr=1864127842 [TCP segment of a reassembled PDU]"
"240","14.746222182","104.26.10.104","172.21.0.134","TCP","1434","443  >  44548 [ACK] Seq=252290 Ack=2084 Win=24576 Len=1368 TSval=81927605 TSecr=1864127842 [TCP segment of a reassembled PDU]"
"241","14.746406347","172.21.0.134","104.26.10.104","TCP","66","44548  >  443 [ACK] Seq=2084 Ack=253658 Win=450048 Len=0 TSval=1864127925 TSecr=81927603"
"242","14.748385152","104.26.10.104","172.21.0.134","TCP","1434","443  >  44548 [PSH, ACK] Seq=253658 Ack=2084 Win=24576 Len=1368 TSval=81927605 TSecr=1864127842 [TCP segment of a reassembled PDU]"
"243","14.748385740","104.26.10.104","172.21.0.134","TCP","2802","443  >  44548 [PSH, ACK] Seq=255026 Ack=2084 Win=24576 Len=2736 TSval=81927607 TSecr=1864127842 [TCP segment of a reassembled PDU]"
"244","14.748508990","172.21.0.134","104.26.10.104","TCP","66","44548  >  443 [ACK] Seq=2084 Ack=257762 Win=458240 Len=0 TSval=1864127927 TSecr=81927605"
"245","14.748385895","104.26.10.104","172.21.0.134","TCP","2802","443  >  44548 [PSH, ACK] Seq=257762 Ack=2084 Win=24576 Len=2736 TSval=81927608 TSecr=1864127842 [TCP segment of a reassembled PDU]"
"246","14.748573937","172.21.0.134","104.26.10.104","TCP","66","44548  >  443 [ACK] Seq=2084 Ack=260498 Win=463744 Len=0 TSval=1864127927 TSecr=81927608"
"247","14.748386067","104.26.10.104","172.21.0.134","TCP","2802","443  >  44548 [PSH, ACK] Seq=260498 Ack=2084 Win=24576 Len=2736 TSval=81927610 TSecr=1864127842 [TCP segment of a reassembled PDU]"
"248","14.748386209","104.26.10.104","172.21.0.134","TLSv1.3","2802","Application Data"
"249","14.748625736","172.21.0.134","104.26.10.104","TCP","66","44548  >  443 [ACK] Seq=2084 Ack=263234 Win=469120 Len=0 TSval=1864127927 TSecr=81927610"
"250","14.748629333","104.26.10.104","172.21.0.134","TCP","2802","443  >  44548 [PSH, ACK] Seq=265970 Ack=2084 Win=24576 Len=2736 TSval=81927613 TSecr=1864127842 [TCP segment of a reassembled PDU]"
"251","14.748679257","172.21.0.134","104.26.10.104","TCP","66","44548  >  443 [ACK] Seq=2084 Ack=265970 Win=474624 Len=0 TSval=1864127927 TSecr=81927612"
"252","14.748699721","172.21.0.134","104.26.10.104","TCP","66","44548  >  443 [ACK] Seq=2084 Ack=268706 Win=480128 Len=0 TSval=1864127928 TSecr=81927613"
"253","14.749744346","104.26.10.104","172.21.0.134","TCP","1434","443  >  44548 [ACK] Seq=268706 Ack=2084 Win=24576 Len=1368 TSval=81927615 TSecr=1864127842 [TCP segment of a reassembled PDU]"
"254","14.776224890","104.26.10.104","172.21.0.134","TCP","1434","[TCP Previous segment not captured] 443  >  44548 [ACK] Seq=271442 Ack=2084 Win=24576 Len=1368 TSval=81927617 TSecr=1864127842 [TCP segment of a reassembled PDU]"
"255","14.776305278","172.21.0.134","104.26.10.104","TCP","78","44548  >  443 [ACK] Seq=2084 Ack=270074 Win=485632 Len=0 TSval=1864127955 TSecr=81927615 SLE=271442 SRE=272810"
"256","14.776765678","104.26.10.104","172.21.0.134","TCP","1434","443  >  44548 [PSH, ACK] Seq=272810 Ack=2084 Win=24576 Len=1368 TSval=81927617 TSecr=1864127842 [TCP segment of a reassembled PDU]"
"257","14.776816095","172.21.0.134","104.26.10.104","TCP","78","[TCP Window Update] 44548  >  443 [ACK] Seq=2084 Ack=270074 Win=488320 Len=0 TSval=1864127956 TSecr=81927615 SLE=271442 SRE=274178"
"258","14.776766030","104.26.10.104","172.21.0.134","TCP","2802","443  >  44548 [PSH, ACK] Seq=274178 Ack=2084 Win=24576 Len=2736 TSval=81927618 TSecr=1864127842 [TCP segment of a reassembled PDU]"
"259","14.776860554","172.21.0.134","104.26.10.104","TCP","78","[TCP Window Update] 44548  >  443 [ACK] Seq=2084 Ack=270074 Win=493824 Len=0 TSval=1864127956 TSecr=81927615 SLE=271442 SRE=276914"
"260","14.776766120","104.26.10.104","172.21.0.134","TCP","2802","443  >  44548 [PSH, ACK] Seq=276914 Ack=2084 Win=24576 Len=2736 TSval=81927620 TSecr=1864127902 [TCP segment of a reassembled PDU]"
"261","14.776766214","104.26.10.104","172.21.0.134","TCP","2802","443  >  44548 [PSH, ACK] Seq=279650 Ack=2084 Win=24576 Len=2736 TSval=81927621 TSecr=1864127904 [TCP segment of a reassembled PDU]"
"262","14.776766301","104.26.10.104","172.21.0.134","TCP","2802","443  >  44548 [PSH, ACK] Seq=282386 Ack=2084 Win=24576 Len=2736 TSval=81927623 TSecr=1864127906 [TCP segment of a reassembled PDU]"
"263","14.776914221","104.26.10.104","172.21.0.134","TCP","1434","443  >  44548 [ACK] Seq=285122 Ack=2084 Win=24576 Len=1368 TSval=81927624 TSecr=1864127906 [TCP segment of a reassembled PDU]"
"264","14.777139545","104.26.10.104","172.21.0.134","TCP","1434","443  >  44548 [PSH, ACK] Seq=286490 Ack=2084 Win=24576 Len=1368 TSval=81927624 TSecr=1864127906 [TCP segment of a reassembled PDU]"
"265","14.777711565","104.26.10.104","172.21.0.134","TCP","1434","443  >  44548 [ACK] Seq=287858 Ack=2084 Win=24576 Len=1368 TSval=81927626 TSecr=1864127908 [TCP segment of a reassembled PDU]"
"266","14.778045490","172.21.0.134","104.26.10.104","TCP","78","[TCP Dup ACK 255#1] 44548  >  443 [ACK] Seq=2084 Ack=270074 Win=493824 Len=0 TSval=1864127957 TSecr=81927615 SLE=271442 SRE=289226"
"267","14.778088449","104.26.10.104","172.21.0.134","TLSv1.3","1434","[TCP Previous segment not captured] , Continuation Data"
"268","14.779242805","172.21.0.134","104.26.10.104","TCP","86","[TCP Dup ACK 255#2] 44548  >  443 [ACK] Seq=2084 Ack=270074 Win=493824 Len=0 TSval=1864127957 TSecr=81927615 SLE=328898 SRE=330266 SLE=271442 SRE=289226"
"269","14.806972240","104.26.10.104","172.21.0.134","TLSv1.3","1434","Continuation Data"
"270","14.807597346","104.26.10.104","172.21.0.134","TLSv1.3","2802","Continuation Data"
"271","14.807597630","104.26.10.104","172.21.0.134","TLSv1.3","2802","Continuation Data"
"272","14.807597720","104.26.10.104","172.21.0.134","TLSv1.3","2802","Continuation Data"
"273","14.807597812","104.26.10.104","172.21.0.134","TLSv1.3","2802","Continuation Data"
"274","14.807707500","104.26.10.104","172.21.0.134","TLSv1.3","2802","Continuation Data"
"275","14.807786566","104.26.10.104","172.21.0.134","TLSv1.3","1434","Continuation Data"
